word,meaning,source,example,frequency
majority,多数;大多数;大半;大部分;多数票;成年法定年龄,cet6,The majority of people support the plan.,high
makeup, makeup;化妆品;化妆;组成;构成;性格;补考,cet6,She wears very little makeup.,high
male,男性的;雄性的;男子;雄性动物;男性,cet6,The male population is slightly larger.,high
mall,购物中心;商场;商业街;林荫道,cet6,The mall is crowded on weekends.,high
man,男人;人;人类;男子汉;丈夫;仆人;员工,cet6,All men are created equal.,high
manage,管理;经营;处理;设法做到;应付;控制,cet6,She manages a large team.,high
management,管理;经营;处理;管理层;管理人员;经营手段,cet6,Good management is essential for success.,high
manager,经理;管理者;管理人;经营人;经纪人,cet6,She is the general manager of the company.,high
mandate,授权;命令;指令;委托;委任;托管,cet6,The government has a mandate to reform the system.,medium
maneuver, maneuver;调动;机动;演习;策略;操纵;花招,cet6,The driver maneuvered the car into the parking space.,medium
manifest,显然的;明显的;表明;显示;显现;表露;货单;旅客名单,cet6,The symptoms manifested themselves after a few days.,medium
manipulate,操纵;控制;操作;处理;巧妙地处理;篡改,cet6,The politician manipulated the media.,high
mankind,人类;人类总称;男人,cet6,The pollution is a threat to all mankind.,high
manner,方式;方法;态度;举止;礼貌;风格;种类,cet6,She spoke in a polite manner.,high
mansion,大厦;公馆;宅邸;官邸;豪华住宅,cet6,The mansion is surrounded by beautiful gardens.,medium
manual,手工的;体力的;手动的;手册;指南;说明书,cet6,Please refer to the user manual for instructions.,high
manufacture,制造;生产;加工;制造;大量生产;捏造;虚构,cet6,The factory manufactures car parts.,high
manufacturer,制造商;生产商;制造厂;生产者,cet6,The manufacturer recalled the defective products.,high
manuscript,手稿;原稿;底稿;手写本;打字稿,cet6,The author submitted the manuscript for publication.,medium
map,地图;图;示意图;天体图;绘制地图;计划;安排,cet6,She drew a map of the area.,high
marathon,马拉松;马拉松赛跑;长距离赛跑;持久的活动;马拉松式的,cet6,She ran a marathon for charity.,medium
marble,大理石;弹珠;大理石制品;大理石花纹;冷酷的;坚硬的,cet6,The floor is made of marble.,medium
march,前进;行军;游行示威;进行曲;稳步前进;迫使前进,cet6,The soldiers marched through the town.,high
margin,边缘;余地;差额;幅度;页边空白;利润;差数,cet6,The company has a profit margin of 20 percent.,high
marginal,边缘的;微小的;不重要的;边际的;仅以微弱多数取胜的,cet6,The increase in sales was marginal.,medium
marine,海洋的;海产的;海军的;海运的;海军陆战队,cet6,Marine life is diverse and fascinating.,high
marital,婚姻的;夫妻关系的;婚姻状态的,cet6,What is your marital status?,medium
maritime,海的;海事的;海运的;海员的;沿海的;海洋性的,cet6,The country has a strong maritime tradition.,medium
mark,标记;符号;痕迹;分数;商标;标志;做标记;注意;纪念,cet6,She got a high mark on the exam.,high
market,市场;集市;行情;销路;交易;上市;推销,cet6,The stock market is volatile.,high
marketing,市场营销;营销;销售;市场推广,cet6,The company spends a lot on marketing.,high
marriage,婚姻;结婚;婚礼;婚姻生活;结合;密切结合,cet6,Their marriage lasted for 50 years.,high
married,已婚的;婚姻的;结合的;密切结合的;结婚的,cet6,She is married to a doctor.,high
marry,结婚;娶;嫁;结合;联合;使结婚;为...主持婚礼,cet6,They married in a small ceremony.,high
marvelous,令人惊奇的;不可思议的;极好的;绝妙的;了不起的,cet6,The performance was marvelous.,medium
Marxist,马克思主义的;马克思主义者,cet6,He studied Marxist theory.,low
mask,面具;面罩;口罩;伪装;掩饰;遮蔽;掩盖,cet6,She wore a mask to protect against the virus.,high
mass,大量;众多;块;团;群众;质量;弥撒;大规模的;群众的,cet6,The protesters gathered in mass.,high
massacre,大屠杀;残杀;屠杀;惨败;彻底击败,cet6,The massacre shocked the world.,low
massive,大量的;巨大的;大规模的;大块的;强烈的,cet6,The earthquake caused massive damage.,high
master,主人;大师;硕士;名家;精通;掌握;主要的;精通的,cet6,She earned a Master degree in economics.,high
masterpiece,杰作;代表作;名著;最杰出的作品,cet6,The painting is considered a masterpiece.,medium
mat,垫子;地垫;席子;衬垫;体操垫;一丛;一簇,cet6,Wipe your feet on the mat.,medium
match,比赛;竞赛;火柴;匹配;配对方;相配;匹配;敌得过,cet6,The match ended in a draw.,high
mate,伙伴;同伴;朋友;配偶;同事;助手;配对;结交,cet6,She found her soul mate.,high
material,材料;原料;物资;资料;素材;物质的;重要的;实质性的,cet6,The building materials are expensive.,high
maternal,母亲的;母性的;母亲的;母亲的;母方的;母系的,cet6,She has strong maternal instincts.,medium
math,数学;数学运算;计算,cet6,She is good at math.,high
matter,事情;问题;物质;材料;内容;重要性;要紧;有关系,cet6,What is the matter with you?,high
mature,成熟的;成年人的;深思熟虑的;到期的;使成熟;变成熟,cet6,She is very mature for her age.,high
maturity,成熟;到期;完备;成熟期;完善,cet6,The bond reaches maturity in five years.,high
maximum,最大的;最高的;最大值的;最大限度;最大值;最高点,cet6,The maximum speed on this road is 80 km/h.,high
mayor,市长;镇长;区长,cet6,The mayor announced the new development plan.,medium
maze,迷宫;迷津;迷惑;错综复杂;混乱,cet6,The children got lost in the maze.,medium
meal,餐;饭;膳食;一次进食;进餐时间;粗碾的谷物;粉,cet6,She cooked a delicious meal.,high
mean,意思是;意味着;想要;打算;意味着;吝啬的;平均的;平均数;平均值,cet6,What does this word mean?,high
meaning,意义;含义;意思;目的;重要性;意图,cet6,The meaning of life is different for everyone.,high
means,方法;手段;方式;收入;财富;资力;工具,cet6,Education is a means to an end.,high
meantime,与此同时;在此期间;其间;当时,cet6,"In the meantime, please enjoy the buffet.",high
meanwhile,与此同时;在此期间;另一方面;同时,cet6,"Meanwhile, the situation was getting worse.",high
measure,测量;度量;衡量;评估;措施;方法;量度;尺寸,cet6,The government took measures to control inflation.,high
measurement,测量;度量;尺寸;大小;测量结果;衡量;度量制,cet6,The measurement must be accurate.,high
meat,肉;肉类;食用肉;实质;内容;核心部分,cet6,She does not eat meat.,high
mechanic,技工;机械师;机修工;工匠;机械的;手工的,cet6,The mechanic fixed my car.,high
mechanical,机械的;力学的;机械式的;呆板的;手工操作的,cet6,The mechanical parts need regular maintenance.,high
mechanism,机制;机理;机械装置;结构;途径;技巧,cet6,The mechanism of the clock is very delicate.,high
medal,奖章;勋章;纪念章;奖牌;徽章,cet6,She won a gold medal at the Olympics.,high
media,媒体;传媒;媒介;新闻界;传播媒介,cet6,The media reported the news widely.,high
mediate,调解;斡旋;调停;居中;传递;作为媒介引起,cet6,The UN mediated the peace talks.,medium
medical,医学的;医疗的;内科的;医药的;医疗的;体检,cet6,She needs urgent medical attention.,high
medication,药物;药物治疗;医药;药剂;药品,cet6,She is on medication for her condition.,high
medicine,药;药物;医学;医疗;内科;内服药,cet6,Take this medicine three times a day.,high
medieval,中世纪的;中古的;古老的;过时的,cet6,The castle dates back to medieval times.,medium
meditation,冥想;沉思;默想;反省;静思;冥想录,cet6,She practices meditation every morning.,medium
medium,中介;媒介;中间的;中等的;适中的;介质;媒体,cet6,She is of medium height.,high
meet,遇见;见面;会合;满足;符合;会议;运动会,cet6,Nice to meet you.,high
meeting,会议;会面;集会;会见;运动会;汇合;接触,cet6,The meeting starts at 9 am.,high
melon,瓜;甜瓜;香瓜;西瓜;瓜类,cet6,The watermelon is ripe.,medium
melt,融化;熔化;溶解;消散;使融化;使软化;使心软,cet6,The ice cream melted in the sun.,high
member,成员;会员;成员;部分;部件;器官;肢体,cet6,She is a member of the club.,high
membership,会员资格;会员身份;会员人数;全体会员,cet6,The membership fee is 100 dollars per year.,high
memo,备忘录;便笺;记录;通知;内部通知,cet6,She sent a memo to all employees.,medium
memoir,回忆录;自传;传记;研究论文;学术论文集,cet6,The former president wrote his memoirs.,medium
memorable,难忘的;值得纪念的;令人难忘的;特别的,cet6,The trip was a memorable experience.,high
memorial,纪念碑;纪念物;纪念的;追悼的;纪念仪式的,cet6,The memorial was built in honor of the soldiers.,high
memory,记忆;回忆;记忆力;纪念;存储;内存;储存器,cet6,She has a good memory for faces.,high
menace,威胁;恐吓;危险;令人威胁的人或事;具有危险的人,cet6,The pollution is a menace to public health.,medium
mend,修理;修补;缝补;改善;恢复;痊愈;改进,cet6,Can you mend the torn shirt?,high
mental,精神的;心理的;智力的;思想的;精神病的;脑力的,cet6,Regular exercise is good for mental health.,high
mentality,心态;心理;思想方法;智力;心理状态,cet6,We need to change our mentality about work.,medium
mention,提到;说起;提及;提名表扬;提及;说到;陈述,cet6,She mentioned your name.,high
menu,菜单;饭菜;菜肴;功能菜单;选项单,cet6,Please show me the menu.,high
merchant,商人;批发商;贸易商;零售商;商业的;商船的,cet6,The merchant sold spices from the East.,medium
mercury,水银;汞;水星;温度计的水银柱,cet6,Mercury is a toxic metal.,medium
mercy,怜悯;宽恕;仁慈;慈悲;幸运;恩惠,cet6,The prisoners begged for mercy.,high
mere,仅仅的;只不过的;纯粹的;极小的;微不足道的,cet6,It is a mere formality.,high
merely,仅仅;只;只不过;只是;纯粹地,cet6,She is merely a child.,high
merge,合并;融合;兼并;汇合;融入;使合并,cet6,The two companies merged.,high
merger,合并;兼并;联合;吸收合并;合并企业,cet6,The merger created the largest company in the industry.,medium
merit,优点;价值;功绩;长处;值得;应受;应得,cet6,The plan has its merits.,high
merry,欢乐的;愉快的;快乐的;兴高采烈的;微醉的,cet6,Merry Christmas!,high
mess,混乱;凌乱;杂乱;困境;脏乱;食堂;军队食堂;弄乱;弄脏;搞糟,cet6,The room was a complete mess.,high
message,消息;信息;口信;音信;电报;启示;要点;主题思想,cet6,She left a message on his voicemail.,high
messenger,信使;送信人;使者;通信员;先驱;前兆,cet6,The messenger delivered the urgent document.,medium
metal,金属;金属制品;金属的;金属制的;金属般的,cet6,The bridge is made of metal.,high
metallic,金属的;金属制的;金属般的;有金属光泽的;刺耳的,cet6,The paint has a metallic finish.,medium
metaphor,隐喻;暗喻;比喻;象征;比拟,cet6,The poet used a powerful metaphor.,medium
meteor,流星;陨星;流星体;大气现象,cet6,A meteor streaked across the sky.,low
meter,米;公尺;计量器;仪表;计;表;用仪表计量,cet6,The room is five meters wide.,high
method,方法;办法;方式;条理;秩序;教学法;方法论,cet6,We need to find a better method.,high
methodology,方法论;方法学;一套方法;教学法,cet6,The research methodology was flawed.,medium
metric,公制的;米制的;度量的;测量的;度量标准,cet6,The metric system is used internationally.,medium
metropolitan,大都市的;大城市的;首都的;主要都市的;宗主国的,cet6,She lives in the metropolitan area.,high
microphone,麦克风;话筒;传声器;扩音器,cet6,She spoke into the microphone.,high
microscope,显微镜;放大镜;微观,cet6,The scientist looked through the microscope.,medium
microwave,微波;微波炉;微波的;用微波炉加热,cet6,She heated the food in the microwave.,high
midday,正午;中午;日中;午时,cet6,The sun is at its highest at midday.,medium
middle,中间;中部;中央;中等;中间的;中等的;中部的,cet6,She sat in the middle of the row.,high
midnight,午夜;子夜;半夜;深夜;漆黑的,cet6,The party continued until midnight.,high
midst,中间;当中;中部;在...之中;在...之间,cet6,She found herself in the midst of a crowd.,high
migrant,移民;移居者;候鸟;迁徙的;移居的;流动的,cet6,The migrant workers returned home for the holidays.,medium
migrate,迁移;移居;迁徙;洄游;转移;向移动,cet6,The birds migrate south for the winter.,high
migration,迁移;移居;迁徙;洄游;流动;转移,cet6,The migration of the birds is an amazing sight.,high
mild,温和的;温柔的;淡味的;轻微的;不严重的;温暖的,cet6,The weather is mild today.,high
mile,英里;海里;一英里赛跑;很长的距离;大量,cet6,She ran for miles.,high
milestone,里程碑;转折点;重大事件;重要阶段,cet6,The invention of the internet was a milestone.,medium
military,军事的;军用的;军队的;军人的;军方;武装力量,cet6,The country has a strong military.,high
militia,民兵;民兵组织;国民自卫队;义勇军,cet6,The militia was called to defend the town.,medium
milk,牛奶;奶;乳;乳汁;乳状物;挤奶;榨取,cet6,She drinks a glass of milk every morning.,high
mill,磨坊;磨粉机;工厂;制造厂;铣床;碾磨;铣,cet6,The paper mill employs 200 workers.,high
millimeter,毫米;公厘,cet6,The insect is only a few millimeters long.,medium
million,百万;百万个;无数;大量;数百万人,cet6,The company is worth millions of dollars.,high
millionaire,百万富翁;大富翁;富豪,cet6,The young entrepreneur became a millionaire.,medium
mind,头脑;智力;思想;精神;注意力;意见;心智;介意;注意;照料,cet6,She has a brilliant mind.,high
mine,矿;矿山;地雷;水雷;我的;采矿;布雷;开采,cet6,The mine produces coal.,high
mineral,矿物;矿石;矿物质;矿物的;含矿物的;无机的,cet6,The water contains minerals.,high
mingle,混合;交往;相混;使混合;使相混;交际,cet6,She mingled with the other guests at the party.,medium
miniature,微小的;小型的;袖珍的;微型画;缩图;微小模型,cet6,She collects miniature dolls.,medium
minimal,最小的;极少的;最小的;最低限度的;最简式的,cet6,The cost is minimal.,high
minimize,最小化;使减少到最低限度;轻视;贬低;对...作最低估计,cet6,We need to minimize the risks.,high
minimum,最小的;最低的;最小值;最低限度;最低点,cet6,You need a minimum of five years of experience.,high
minister,部长;大臣;牧师;公使;外交使节;服侍,cet6,The Prime Minister gave a press conference.,high
ministry,部;政府部门;内阁;神职;牧师职位,cet6,She works at the Ministry of Education.,high
minor,较小的;次要的;轻微的;未成年的;未成年人;副修科目,cet6,She suffered minor injuries.,high
minority,少数;少数派;少数民族;未成年;少数群体,cet6,Only a minority of people voted against it.,high
mint,薄荷;薄荷糖;铸币厂;大量的钱;铸造;创造,cet6,The coins were minted in the royal mint.,medium
minus,减;减去;零下;负的;不利的;减号;负号;负数,cet6,Ten minus three is seven.,high
minute,分钟;片刻;微小的;详细的;记录;会议记录,cet6,The meeting will start in five minutes.,high
miracle,奇迹;奇事;不可思议的事;神迹;惊人的事例,cet6,It is a miracle that she survived.,high
mirror,镜子;反射;反映;写照;真实反映;借鉴,cet6,She looked at herself in the mirror.,high
miserable,悲惨的;痛苦的;可怜的;糟糕的;令人难受的,cet6,The refugees lived in miserable conditions.,high
misery,痛苦;悲惨;苦难;不幸;贫穷;折磨,cet6,The war caused great misery.,high
misfortune,不幸;厄运;灾祸;灾难;逆境;倒霉的事,cet6,She had the misfortune to lose her keys.,medium
mislead,误导;引入歧途;欺骗;使误解;使误入歧途,cet6,The advertisement misled consumers.,high
miss,想念;错过;未击中;未看到;遗漏;小姐;失误,cet6,She missed the bus.,high
missile,导弹;飞弹;投射物;发射物;投掷物,cet6,The missile was launched successfully.,high
missing,缺失的;丢失的;失踪的;缺少的;不在的,cet6,The missing child was found safe.,high
mission,使命;任务;代表团;布道;使团;传教;派遣,cet6,The mission was accomplished successfully.,high
missionary,传教士;传教的;传教士的;使命的,cet6,The missionary traveled to Africa.,medium
mist,薄雾;雾气;雾;朦胧;模糊不清;使模糊,cet6,The morning mist covered the valley.,high
mistake,错误;过错;失误;误会;误解;弄错;误认,cet6,Everyone makes mistakes.,high
mistress,情妇;女主人;女教师;女主管;女能手,cet6,The mistress of the house welcomed the guests.,medium
misunderstand,误解;误会;曲解;不理解,cet6,She misunderstood his intentions.,high
mix,混合;搅拌;结合;交往;混合;混合物;混杂,cet6,Mix the flour and water together.,high
mixture,混合;混合物;集合;混合体;混合剂;交融,cet6,The cake mixture tastes good.,high
moan,呻吟;悲叹;抱怨;呜咽;呻吟声;抱怨声,cet6,He moaned in pain.,medium
mob,暴民;乌合之众;一群人;成群结队;围攻;聚众袭击,cet6,The mob gathered outside the palace.,medium
mobile,移动的;可动的;流动的;易变的;手机;移动电话;动态,cet6,She is always on her mobile phone.,high
mobilize,动员;调动;动用;使流通;使活动;动员起来,cet6,The government mobilized the army.,medium
mock,嘲笑;嘲弄;模拟;仿制;假的;模拟的;假冒的,cet6,The students mocked his accent.,medium
mode,方式;模式;风格;时尚;样式;状态;调式,cet6,The factory changed its production mode.,high
model,模型;模特;模式;模范;型号;典范;模拟;塑造,cet6,She works as a fashion model.,high
moderate,适度的;温和的;中等的;稳健的;节制;缓和;减轻,cet6,The temperature is moderate today.,high
modern,现代的;近代的;当代的;新式的;现代化的,cet6,The building has a modern design.,high
modernization,现代化;现代化过程;现代化的事物,cet6,The country is undergoing rapid modernization.,high
modest,谦虚的;谦逊的;适度的;适中的;朴素的;端庄的,cet6,She is very modest about her achievements.,high
modify,修改;更改;调整;修饰;缓和;减轻,cet6,The contract was modified to include new terms.,high
module,模块;组件;单元;舱;模数;模件;模块,cet6,The software consists of several modules.,high
moist,潮湿的;湿润的;多雨的;微湿的;湿气重的,cet6,The soil is moist after the rain.,medium
moisture,湿气;水分;湿度;潮气;潮湿;含水量,cet6,The moisture in the air makes it feel sticky.,medium
molecule,分子;微粒;微小颗粒;一点,cet6,A water molecule consists of two hydrogen atoms and one oxygen atom.,high
moment,时刻;瞬间;片刻;时机;重要;重要时刻,cet6,Please wait a moment.,high
momentous,重大的;重要的;关键的;有深远影响的,cet6,The discovery was a momentous event.,medium
momentum,动量;势头;动力;冲力;冲量;契机,cet6,The campaign gained momentum.,high
monarch,君主;帝王;女王;最高统治者;国王,cet6,The monarch lives in the palace.,medium
monarchy,君主制;君主国;君主政体;皇室;王室,cet6,The monarchy has a long history.,medium
monastery,修道院;寺院;僧院;庙宇,cet6,The monks live in the monastery.,medium
monetary,货币的;金钱的;金融的;财政的;钱的,cet6,The government implemented a new monetary policy.,high
money,钱;货币;财富;资金;金钱;收入;款项,cet6,Money cannot buy happiness.,high
monitor,监控;监视;监测;监控器;显示器;班长;监听员,cet6,The doctor monitored her condition closely.,high
monk,僧侣;和尚;修道士;修士;出家人,cet6,The monk meditated in the temple.,medium
monkey,猴子;猿;顽皮的人;受支配的人;模仿;胡闹,cet6,The monkey climbed up the tree.,high
monopoly,垄断;独占;专卖;垄断权;垄断企业;独占者,cet6,The company has a monopoly on the market.,medium
monotonous,单调的;乏味的;千篇一律的;无变化的;枯燥的,cet6,The work is monotonous and boring.,medium
monster,怪物;怪兽;妖怪;恶魔;巨大的;庞大的;怪异的,cet6,The monster in the movie was terrifying.,high
month,月;月份;一个月的时间;数月,cet6,She will return in a month.,high
monthly,每月的;每月一次的;按月的;月刊;每月地,cet6,She reads a monthly magazine.,high
monument,纪念碑;纪念物;纪念塔;遗迹;丰碑;不朽的作品,cet6,The monument honors the war heroes.,high
mood,心情;情绪;心境;状态;基调;语气,cet6,She is in a good mood today.,high
moon,月亮;月球;月光;卫星;月状物;阴历月;渴望;闲荡,cet6,The moon is full tonight.,high
moral,道德的;伦理的;道义上的;品行端正的;寓意;教益;道德规范,cet6,The story has a moral.,high
morale,士气;精神面貌;斗志;民心;道德,cet6,The team morale is high after the victory.,medium
morality,道德;美德;道德规范;道义;伦理;品德;道德原则,cet6,We need to uphold high moral standards.,high
moreover,此外;而且;再者;加之;除此之外,cet6,"Moreover, the cost is too high.",high
morning,早晨;上午;清晨;早晨的;上午的,cet6,She goes jogging every morning.,high
mortal,终有一死的;会死的;致命的;极大的;凡人;人类,cet6,All humans are mortal.,medium
mortgage,抵押;抵押贷款;按揭;房屋贷款;抵押借款;抵押权,cet6,She took out a mortgage to buy the house.,medium
mosaic,马赛克;镶嵌图案;镶嵌工艺;拼花;镶嵌的;拼成的,cet6,The floor is decorated with mosaic tiles.,medium
mosquito,蚊子;蚊虫;蚊香,cet6,The mosquito bit me on the arm.,medium
moss,苔藓;地衣;藓类植物;苔藓状物,cet6,The rocks were covered with moss.,medium
mostly,主要地;通常;多半;大部分;基本上;几乎全部,cet6,The students are mostly from Asia.,high
motel,汽车旅馆;汽车酒店,cet6,We stayed at a motel on the highway.,medium
moth,蛾;飞蛾;蠹虫;蛀虫,cet6,The moth was attracted to the light.,medium
mother,母亲;妈妈;母爱;本源;根源;起源;母亲的;母爱的,cet6,Her mother is a teacher.,high
motion,运动;移动;动作;手势;提议;动议;运动;移动;示意,cet6,The motion of the waves was soothing.,high
motivate,激发;促使;诱导;刺激;成为...的动机,cet6,A good teacher motivates students to learn.,high
motivation,动机;动力;积极性;激励;刺激;诱因,cet6,She lacks motivation to study.,high
motive,动机;目的;原因;主旨;运动的;使动的;引起运动的,cet6,What was his motive for the crime?,high
motor,马达;发动机;电动机;汽车;机动车辆;由马达推动的;机动的,cet6,The motor of the car needs repair.,high
motorcycle,摩托车;机车;机动脚踏车,cet6,He rides a motorcycle to work.,medium
motorway,高速公路;快速干道;汽车道,cet6,The motorway is busy during rush hour.,medium
motto,座右铭;格言;箴言;准则;训言;警句,cet6,Her motto is never give up.,medium
mound,土堆;山丘;土墩;堆;小丘;岗,cet6,The children built a mound of sand.,medium
mount,登上;骑上;安装;增加;增长;山;山峰;支架,cet6,She mounted the horse with ease.,high
mountain,山;山脉;高山;大量;一大堆;山岳;似山的,cet6,The mountain is over 3000 meters high.,high
mourn,哀悼;悲悼;悲伤;悼念;哀伤;惋惜,cet6,The nation mourned the loss of the leader.,medium
mouse,老鼠;耗子;鼠标;胆小如鼠的人;羞怯的人,cet6,The cat chased the mouse.,high
mouth,嘴;口;口腔;嘴巴;张口;入口;开口,cet6,She opened her mouth to speak.,high
move,移动;搬动;调动;感动;搬家;行动;步骤;措施,cet6,She moved to a new apartment.,high
movement,运动;移动;活动;动作;调动;乐章;趋势;动向,cet6,The civil rights movement changed history.,high
movie,电影;影片;电影院;电影业;电影的;影片的,cet6,She went to see a movie with her friends.,high
mud,泥;泥浆;污泥;淤泥;烂泥;污蔑;诽谤,cet6,The car got stuck in the mud.,high
muddy,泥泞的;多泥的;浑浊的;模糊的;使沾上泥;使浑浊,cet6,The path was muddy after the rain.,medium
mug,马克杯;大杯子;一杯的量;脸;嘴;抢劫;打劫,cet6,She drank a mug of coffee.,medium
multiple,多个的;多种的;许多的;倍数;多样的;复合的,cet6,The company offers multiple payment options.,high
multiply,乘;乘以;增加;繁殖;使增加;使倍增,cet6,Multiply three by five equals fifteen.,high
multitude,大量;众多;群众;大批;许多;多数;广大民众,cet6,A multitude of people attended the concert.,high
municipal,市的;市政的;地方的;自治市的;市立的,cet6,The municipal government built a new park.,high
murder,谋杀;凶杀;杀害;谋杀案;凶杀案;杀害,cet6,The murder was solved by the detective.,high
murmur,低语;喃喃声;咕哝;小声说话;发牢骚;发出轻音,cet6,She murmured a reply.,medium
muscle,肌肉;肌;力量;体力;实力;影响力;使劲,cet6,She has strong muscles from working out.,high
museum,博物馆;博物院;展览馆;陈列馆,cet6,The museum has a collection of ancient artifacts.,high
mushroom,蘑菇;伞菌;迅速增长;迅速发展;蘑菇状的,cet6,The mushroom grows in the forest.,medium
music,音乐;乐曲;乐谱;音乐作品;美妙的声音;音乐艺术,cet6,She loves listening to music.,high
musical,音乐的;有音乐才能的;音乐剧;音乐片;音乐的;悦耳的,cet6,She is very musical.,high
musician,音乐家;作曲家;乐师;演奏家;音乐人,cet6,The musician played the violin beautifully.,high
