word,meaning,source,example,frequency
abandon,放弃;遗弃,cet4,They had to abandon the sinking ship.,high
ability,能力;才能,cet4,She has the ability to learn languages quickly.,high
absorb,吸收;吸引,cet4,Plants absorb carbon dioxide from the air.,high
access,通道;接近;使用权限,cet4,Students have access to the library 24 hours a day.,high
achieve,实现;达到,cet4,You need to work hard to achieve your goals.,high
acquire,获得;学到,cet4,It took years to acquire the necessary skills.,high
adapt,适应;改编,cet4,Animals must adapt to their environment to survive.,high
adjust,调整;适应,cet4,It takes time to adjust to a new culture.,medium
admire,钦佩;欣赏,cet4,I admire your dedication to learning.,medium
adopt,采纳;收养,cet4,The committee adopted the new regulations.,high
advance,前进;进步;预付,cet4,Technology has advanced rapidly in recent years.,high
advantage,优势;有利条件,cet4,Being bilingual gives you a big advantage.,high
affect,影响;感动,cet4,The weather affects my mood significantly.,high
afford,负担得起;提供,cet4,I cannot afford to buy a new car right now.,high
alternative,替代的;可供选择的,cet4,We need to find alternative sources of energy.,high
amount,数量;总额,cet4,A large amount of money was spent on the project.,high
analyze,分析;解析,cet4,The data was analyzed carefully before making a decision.,high
annual,每年的;年度的,cet4,The company publishes an annual report.,medium
anxiety,焦虑;担心,cet4,Waiting for the results caused a lot of anxiety.,medium
apparent,明显的;表面的,cet4,It became apparent that he was lying.,medium
appeal,呼吁;吸引;上诉,cet4,The idea of traveling abroad appeals to me.,medium
apply,申请;应用;适用,cet4,You should apply for the scholarship before the deadline.,high
appreciate,欣赏;感激;领会,cet4,I really appreciate your help with this project.,high
approach,接近;方法;途径,cet4,We need a new approach to solve this problem.,high
approve,批准;赞成,cet4,The board approved the new budget.,medium
arise,出现;产生;起身,cet4,Problems may arise if we do not plan ahead.,high
arrange,安排;整理,cet4,Can you arrange a meeting for next week?,medium
artificial,人工的;人造的;虚假的,cet4,Artificial intelligence is transforming many industries.,medium
assume,假设;承担;呈现,cet4,I assume you have already read the instructions.,high
attempt,尝试;企图,cet4,She made an attempt to solve the puzzle.,high
attend,参加;出席;上(学),cet4,All employees must attend the safety training.,high
attitude,态度;看法,cet4,Your attitude determines your success.,high
attract,吸引;引起,cet4,The museum attracts millions of visitors each year.,high
authority,权威;当局;权力,cet4,The local authorities are responsible for road maintenance.,medium
available,可用的;有效的;有空的,cet4,Is this seat available?,high
avoid,避免;回避,cet4,You should avoid eating too much sugar.,high
aware,意识到;知道的,cet4,Are you aware of the risks involved?,high
barrier,障碍;屏障,cet4,Language can be a barrier to communication.,medium
benefit,利益;好处;受益,cet4,Regular exercise has many health benefits.,high
brief,简短的;简洁的;摘要,cet4,Please give me a brief summary of the report.,high
budget,预算;预算的,cet4,We need to plan our budget carefully this year.,medium
campaign,运动;战役;竞选活动,cet4,The company launched a new advertising campaign.,medium
capable,有能力的;能干的,cet4,She is capable of solving complex problems.,high
capacity,容量;能力;资格,cet4,The stadium has a seating capacity of 50000.,medium
career,职业;生涯,cet4,She had a successful career in journalism.,high
celebrate,庆祝;颂扬,cet4,How do you plan to celebrate your birthday?,high
challenge,挑战;质疑,cet4,Learning a new language is a big challenge.,high
character,性格;特征;人物;字符,cet4,He is a man of strong character.,high
claim,声称;要求;索赔,cet4,She claims to have seen the accident happen.,high
climate,气候;风气;氛围,cet4,The Mediterranean climate is mild and pleasant.,medium
collapse,倒塌;崩溃;瓦解,cet4,The building collapsed after the earthquake.,medium
comment,评论;意见;注释,cet4,Do you have any comments on the proposal?,high
commit,犯(罪);承诺;致力于,cet4,She is committed to improving the environment.,high
communicate,交流;传播;沟通,cet4,It is important to communicate clearly with your team.,high
community,社区;团体;共同体,cet4,The local community supported the charity event.,high
compare,比较;对比;比喻,cet4,If you compare the two products this one is better.,high
compete,竞争;比赛;对抗,cet4,Companies must compete to attract customers.,medium
complex,复杂的;综合的;综合体,cet4,The brain is an incredibly complex organ.,high
component,成分;组件;部件,cet4,Each component of the system must work correctly.,medium
concentrate,集中;专注;浓缩,cet4,I need to concentrate on my studies.,high
concept,概念;观念,cet4,The concept of time varies across cultures.,high
concern,关心;担忧;涉及;企业,cet4,Environmental issues are a major concern for everyone.,high
conclude,总结;推断;结束,cet4,The report concludes that further research is needed.,high
conduct,行为;实施;引导;指挥,cet4,The experiment was conducted under strict conditions.,high
confidence,信心;信任;自信,cet4,She spoke with great confidence during the interview.,high
confirm,确认;证实;批准,cet4,Can you confirm your reservation by email?,medium
conflict,冲突;矛盾;斗争,cet4,The two countries have been in conflict for decades.,high
connect,连接;联系;接通,cet4,The bridge connects the two sides of the river.,high
conscious,有意识的;自觉的;清醒的,cet4,She was conscious of the danger but proceeded anyway.,medium
consequence,结果;后果;重要性,cet4,Global warming is a consequence of human activity.,high
consider,考虑;认为;体贴,cet4,You should consider all the options before deciding.,high
consistent,一致的;始终如一的,cet4,His actions are not consistent with his words.,medium
constant,不变的;恒定的;持续的,cet4,The machine runs at a constant speed.,high
construct,建造;构建;创立,cet4,The bridge was constructed in 1998.,medium
contact,联系;接触;交往,cet4,Please contact us if you have any questions.,high
contain,包含;容纳;控制,cet4,The box contains several old photographs.,high
contribute,贡献;捐献;促成,cet4,Everyone should contribute to protecting the environment.,high
convenient,方便的;便利的,cet4,The location is convenient for public transportation.,high
convince,说服;使确信,cet4,I am not convinced that the plan will work.,high
cooperate,合作;协作;配合,cet4,The two companies agreed to cooperate on the project.,medium
credit,信用;学分;赞扬;信贷,cet4,She deserves credit for her hard work.,high
critical,批评的;关键的;危急的,cet4,It is critical that we finish the project on time.,high
current,当前的;流动的;电流;趋势,cet4,The current situation requires immediate action.,high
debate,辩论;争论;讨论,cet4,There is an ongoing debate about climate change.,medium
decade,十年;十年期,cet4,Over the past decade technology has changed dramatically.,high
decline,下降;拒绝;衰落,cet4,The population of the village has declined sharply.,high
defend,防御;保卫;辩护,cet4,Soldiers defend the country from attack.,high
define,定义;界定;明确,cet4,How would you define success?,high
delay,延迟;推迟;拖延,cet4,The flight was delayed due to bad weather.,high
deliver,递送;交付;发表;接生,cet4,The postman delivers mail every morning.,high
demand,需求;要求;需要,cet4,There is a high demand for skilled workers.,high
demonstrate,展示;证明;示范;游行,cet4,The experiment demonstrates the theory of gravity.,high
depend,依赖;依靠;取决于,cet4,The success of the project depends on teamwork.,high
deserve,应得;值得,cet4,You deserve a break after all that hard work.,high
despite,尽管;不管;不顾,cet4,Despite the rain we enjoyed the picnic.,high
destroy,破坏;摧毁;消灭,cet4,The earthquake destroyed many buildings.,high
determine,决定;确定;测定,cet4,The exam results will determine your future.,high
develop,发展;开发;培养;产生,cet4,The company develops new software products.,high
distinguish,区分;辨别;使杰出,cet4,It is hard to distinguish between the two twins.,high
diverse,不同的;多样的;形形色色的,cet4,The city has a diverse population.,high
document,文件;文档;记录;记载,cet4,Please read the document carefully before signing.,high
dramatic,戏剧性的;巨大的;突然的,cet4,There has been a dramatic increase in sales.,high
economy,经济;节约;理财,cet4,The country economy is growing rapidly.,high
educate,教育;培养;训练,cet4,The program aims to educate the public about health risks.,high
efficient,高效的;有效的;有能力的,cet4,The new system is more efficient than the old one.,high
eliminate,消除;淘汰;排除,cet4,Regular exercise helps eliminate stress.,high
emerge,出现;浮现;显露,cet4,New evidence has emerged in the case.,high
emotion,情感;情绪;感情,cet4,The movie evokes strong emotions in the audience.,high
emphasis,强调;重点;重要性,cet4,The school places great emphasis on academic achievement.,high
employ,雇用;使用;利用,cet4,The company employs over 5000 people.,high
enable,使能够;使可能;启用,cet4,This scholarship enabled me to attend university.,high
encourage,鼓励;激励;促进,cet4,Parents should encourage their children to read.,high
engage,参与;从事;吸引;订婚,cet4,The speaker engaged the audience with his stories.,high
enhance,增强;提高;美化,cet4,Regular exercise enhances your overall health.,high
ensure,确保;保证;担保,cet4,Please ensure that all doors are locked before leaving.,high
enterprise,企业;事业;进取心,cet4,Small and medium enterprises are the backbone of the economy.,medium
enthusiasm,热情;热心;热忱,cet4,Her enthusiasm for teaching is contagious.,medium
environment,环境;周围;生态环境,cet4,We must protect the environment for future generations.,high
essential,基本的;必要的;本质的,cet4,Water is essential for life.,high
establish,建立;设立;确立;安置,cet4,The company was established in 1990.,high
evaluate,评估;评价;估值,cet4,The teacher will evaluate your performance.,medium
evidence,证据;迹象;证明,cet4,There is strong evidence that smoking causes cancer.,high
evolve,进化;演变;发展,cet4,Species evolve over millions of years.,medium
examine,检查;考试;审视,cet4,The doctor examined the patient thoroughly.,high
exchange,交换;兑换;交流;交易所,cet4,We exchanged contact information.,high
exclude,排除;排斥;拒绝,cet4,The cost of food is excluded from the ticket price.,medium
expand,扩大;扩展;膨胀;展开,cet4,The company plans to expand its operations overseas.,high
expect,期望;预期;期待,cet4,We expect the results to arrive next week.,high
expert,专家;行家;熟练的,cet4,She is an expert in ancient history.,high
explore,探索;探险;考察;探究,cet4,The team explored the cave system.,high
expose,暴露;揭露;使接触;曝光,cet4,The documentary exposed the truth about the scandal.,high
extend,延伸;扩展;给予;延长,cet4,The meeting was extended by another hour.,high
extreme,极端的;极度的;极限,cet4,Extreme weather events are becoming more common.,high
factor,因素;要素;因子;系数,cet4,Several factors contributed to the decision.,high
feature,特征;特点;容貌;以...为特色,cet4,The new phone has many advanced features.,high
finance,金融;财政;资金;融资,cet4,The project needs additional finance.,high
flexible,灵活的;柔韧的;可变通的,cet4,We need a flexible approach to solve this problem.,high
frequent,频繁的;经常的;常见的,cet4,There are frequent flights between the two cities.,high
fulfill,实现;履行;满足;完成,cet4,She fulfilled her dream of becoming a doctor.,high
function,功能;作用;函数;运行,cet4,The heart function is to pump blood.,high
fundamental,基本的;根本的;重要的;基本原理,cet4,Economic growth is fundamental to the country development.,high
generate,产生;生成;引起;发电,cet4,The wind turbines generate electricity.,high
global,全球的;全面的;球形的,cet4,Global warming is a serious issue.,high
grant,授予;允许;承认;补助金,cet4,The government granted funding for the research.,high
highlight,强调;突出;亮点;强调部分,cet4,The report highlights the need for reform.,high
identify,识别;认出;确定;确认;认同,cet4,Can you identify the man in this photo?,high
ignore,忽视;不理会;忽略,cet4,Do not ignore the warning signs.,high
illustrate,说明;阐明;举例说明;插图,cet4,The diagram illustrates how the system works.,medium
immediate,立即的;直接的;紧迫的;当前的,cet4,The patient needs immediate medical attention.,high
impact,影响;冲击;撞击;作用,cet4,The new policy had a significant impact on the economy.,high
implement,实施;执行;工具;器具,cet4,The new regulations will be implemented next month.,medium
imply,暗示;意味着;隐含;表明,cet4,What are you implying by that remark?,medium
indicate,表明;指示;暗示;指出,cet4,The results indicate that the treatment is effective.,high
individual,个人的;个别的;个人;个体,cet4,Each individual has unique talents.,high
influence,影响;势力;感化;有影响的人,cet4,Her speech had a profound influence on the audience.,high
inform,通知;告知;告发;赋特征,cet4,Please inform us of any changes in your schedule.,high
initial,最初的;开始的;首字母;初始的,cet4,Our initial plan was to travel by train.,high
innovation,创新;革新;新方法,cet4,Technological innovation drives economic growth.,medium
inspire,激励;鼓舞;启发;赋予灵感,cet4,The teacher inspired her students to pursue their dreams.,high
intelligent,聪明的;明智的;有智慧的;智能的,cet4,She is an intelligent student who always asks good questions.,high
intense,强烈的;激烈的;紧张的;热情的,cet4,The intense heat made it difficult to work.,high
invest,投资;投入(时间/精力);授予,cet4,You should invest your money wisely.,high
investigate,调查;研究;审查;侦察,cet4,The police are investigating the cause of the accident.,high
involve,涉及;包含;使卷入;参与,cet4,The project involves a lot of teamwork.,high
issue,问题;议题;发行;发布;分发,cet4,Environmental issues are a global concern.,high
knowledge,知识;了解;学问;掌握,cet4,Knowledge is power.,high
labor,劳动;工作;劳动力;分娩,cet4,The construction requires a lot of physical labor.,high
launch,发射;发起;推出;启动;上市,cet4,The company will launch a new product next month.,high
legal,法律的;合法的;法定的;法律上的,cet4,You should seek legal advice before signing the contract.,high
limit,限制;限度;界限;极限,cet4,There is a limit to what we can achieve in one day.,high
maintain,维持;保持;保养;坚持;维护,cet4,It is important to maintain good health through exercise.,high
massive,大量的;巨大的;大规模的;大块的,cet4,The earthquake caused massive damage to the city.,high
maximum,最大的;最高的;最大值;极限,cet4,The maximum speed on this road is 80 kilometers per hour.,high
mental,精神的;心理的;智力的;思想的,cet4,Regular exercise is good for both physical and mental health.,high
minimum,最小的;最低的;最小值;最低限度,cet4,You need a minimum of five years of experience.,high
motivate,激发;促使;诱导;刺激,cet4,A good teacher motivates students to learn.,high
multiple,多个的;多种的;倍数;多样的,cet4,The company offers multiple payment options.,high
negative,否定的;消极的;负面的;负的;阴性的,cet4,The feedback was mostly negative.,high
numerous,众多的;大量的;无数的,cet4,Numerous studies have shown the benefits of exercise.,high
obtain,获得;得到;获取;达到,cet4,You need to obtain a visa before traveling.,high
obvious,明显的;显然的;显而易见的,cet4,It was obvious that he was lying.,high
opportunity,机会;机遇;时机;良机,cet4,Do not miss this opportunity to study abroad.,high
organize,组织;安排;整理;筹办,cet4,The students organized a charity event.,high
original,原始的;最初的;独创的;原版的;原件,cet4,The original manuscript was lost centuries ago.,high
outcome,结果;结局;后果;成果,cet4,The outcome of the election was a surprise.,high
overcome,克服;战胜;征服;解决;压倒,cet4,She overcame her fear of public speaking.,high
participate,参加;参与;加入;分享,cet4,Everyone is encouraged to participate in the discussion.,high
particular,特别的;特定的;详细的;挑剔的;详细说明,cet4,Is there any particular reason for your decision?,high
perform,表演;执行;表现;履行;运行,cet4,The team performed well in the competition.,high
permit,允许;许可;准许;许可证;执照,cet4,Smoking is not permitted in this building.,high
physical,身体的;物理的;物质的;实际的;体检,cet4,Regular physical activity is good for your health.,high
policy,政策;方针;策略;保险单,cet4,The government introduced a new education policy.,high
population,人口;种群;人口数量;居民,cet4,The population of the city has grown rapidly.,high
possess,拥有;具有;支配;占据;控制,cet4,She possesses a great talent for painting.,high
potential,潜在的;可能的;潜力;可能性;电势,cet4,The new technology has great potential.,high
practical,实际的;实用的;实践的;可行的;注重实效的,cet4,The course provides practical skills for the workplace.,high
predict,预测;预言;预报;预计;预告,cet4,It is difficult to predict what will happen in the future.,high
prefer,更喜欢;偏好;宁愿;提出;提升,cet4,I prefer coffee to tea in the morning.,high
pressure,压力;压强;压迫;迫使;施压,cet4,She works well under pressure.,high
principle,原则;原理;准则;主义;信条,cet4,Honesty is an important principle to live by.,high
priority,优先;优先权;重点;首要事情;优先级,cet4,Education should be given top priority.,high
procedure,程序;手续;步骤;流程;规程,cet4,What is the procedure for applying for a visa?,medium
process,过程;程序;加工;处理;流程;方法,cet4,The manufacturing process has been improved.,high
profit,利润;利益;盈利;收益;得益,cet4,The company made a large profit this year.,high
progress,进步;进展;前进;发展;进程,cet4,She has made good progress in her studies.,high
project,项目;计划;工程;投影;投射;突出,cet4,The new construction project will create many jobs.,high
promote,促进;提升;推广;晋升;促销,cet4,The campaign promotes healthy eating habits.,high
proof,证据;证明;检验;证实;校样;防...的,cet4,There is no proof that he committed the crime.,high
property,财产;房产;属性;性质;所有权,cet4,The hotel is private property.,high
propose,提议;建议;打算;求婚;推荐,cet4,I propose that we hold the meeting next week.,medium
prospect,前景;展望;可能性;潜在客户;勘探,cet4,The job prospects in this field are excellent.,medium
publish,出版;发表;发行;公布;发布,cet4,The journal is published monthly.,high
purchase,购买;采购;购置;购买行为;紧握,cet4,She made a large purchase online.,high
pursue,追求;追赶;继续;从事;追捕,cet4,She decided to pursue a career in medicine.,high
quality,质量;品质;优质;性质;特点;素质,cet4,The quality of the product is excellent.,high
range,范围;幅度;山脉;等级;排列;分类,cet4,The hotel offers a wide range of services.,high
rapid,快速的;迅速的;快的;湍急的;急促的,cet4,The patient made a rapid recovery.,high
rate,比率;速度;等级;费用;评价;估价,cet4,The exchange rate fluctuates daily.,high
recognize,认出;识别;承认;认可;认识;意识到,cet4,I recognized her from her photo.,high
recommend,推荐;建议;介绍;举荐;劝告,cet4,I recommend that you see a doctor.,high
recover,恢复;康复;收回;找回;弥补;重新获得,cet4,It took her months to recover from the illness.,high
reduce,减少;降低;缩小;简化;减肥;还原,cet4,We need to reduce our expenses.,high
refer,参考;提及;引用;提交;咨询;涉及,cet4,Please refer to the manual for instructions.,high
reflect,反映;反射;体现;思考;显示;表达,cet4,The results reflect the hard work of the team.,high
refuse,拒绝;回绝;垃圾;废物;不愿,cet4,She refused to answer the question.,high
regard,认为;看待;尊敬;问候;方面;考虑,cet4,I regard him as one of the best teachers.,high
region,地区;区域;范围;领域;地带;行政区,cet4,The region is known for its wine production.,high
register,登记;注册;记录;挂号;注册器;登记簿,cet4,You need to register for the course online.,high
reject,拒绝;否决;排斥;拒绝接受;驳回;不合格品,cet4,The board rejected the proposal.,high
relate,涉及;有关;叙述;关联;理解;产生共鸣,cet4,The witness related what she saw that night.,high
release,释放;发布;发行;解除;放开;排放,cet4,The prisoner was released on bail.,high
relevant,相关的;有关的;贴切的;切题的;有意义的,cet4,Is this information relevant to the case?,high
rely,依赖;依靠;信赖;信任;指望,cet4,You can rely on me to help you.,high
remain,保持;留下;剩余;仍然;继续;遗留,cet4,Please remain seated until the plane lands.,high
remove,移除;除去;消除;脱掉;免职;搬迁,cet4,Please remove your shoes before entering.,high
replace,替换;取代;放回;归还;代替;接替,cet4,The old system has been replaced by a new one.,high
represent,代表;表示;表现;描绘;象征;意味着,cet4,The graph represents the sales data.,high
request,请求;要求;申请;恳求;邀请,cet4,Your request has been approved.,high
require,需要;要求;命令;规定;需要;需求,cet4,This job requires a lot of patience.,high
reserve,保留;预订;储备;保护区;矜持;保存,cet4,I would like to reserve a table for two.,high
resist,抵抗;抵制;反抗;抗拒;忍住;阻挡,cet4,She could not resist the temptation to buy the dress.,high
resource,资源;财力;智谋;策略;资料;来源,cet4,The country is rich in natural resources.,high
respond,回答;反应;响应;回应;应答;回复,cet4,The company responded quickly to customer complaints.,high
responsible,负责的;有责任的;可靠的;责任重大的;作为原因的,cet4,Who is responsible for this mistake?,high
reveal,揭示;透露;显示;泄露;展现;揭露,cet4,The investigation revealed the truth.,high
revenue,收入;税收;收益;财政收入;税务;营收,cet4,The company revenue increased by 20 percent.,high
satisfy,满足;使满意;符合;达到;满足要求;使信服,cet4,The product satisfies the needs of most customers.,high
scale,规模;刻度;比例;等级;范围;天平;鳞片;按比例缩放,cet4,The company operates on a global scale.,high
schedule,日程;时间表;计划;排程;安排;时刻表,cet4,The flight is on schedule.,high
secure,安全的;牢固的;稳固的;获得;保护;使安全;担保,cet4,Make sure the doors are secure before leaving.,high
seek,寻找;寻求;追求;探索;征求;试图,cet4,You should seek professional advice.,high
select,选择;挑选;选拔;精选的;优等的;筛选,cet4,Please select the correct answer from the list.,high
solution,解决方案;溶液;解答;溶解;答案;解决办法,cet4,We need to find a solution to the problem.,high
source,来源;源头;出处;根源;消息来源;起源,cet4,The river has its source in the mountains.,high
specific,具体的;特定的;明确的;详细的;特有的;专门的,cet4,Can you be more specific about what you want?,high
spread,传播;散布;扩散;展开;涂抹;伸展;蔓延,cet4,The news spread quickly through the village.,high
stable,稳定的;稳固的;牢固的;坚定的;可靠的;马厩;稳定的,cet4,The patient condition is stable.,high
standard,标准;水准;规范;标准规格;普通的;标准的;正常的,cet4,The product meets international quality standards.,high
status,地位;身份;状态;状况;情形;重要身份,cet4,What is your marital status?,high
steady,稳定的;稳固的;持续的;坚定的;稳健的;使稳定,cet4,She has a steady job.,high
strategy,策略;战略;规划;计谋;行动计划;策略性,cet4,The company needs a new marketing strategy.,high
strength,力量;力气;优点;强度;实力;长处;浓度,cet4,Regular exercise increases physical strength.,high
stress,压力;强调;紧张;重音;应力;重要性;加压力于,cet4,Work-related stress can affect your health.,high
structure,结构;构造;体系;建筑物;组织;构成;安排,cet4,The building has a unique structure.,high
struggle,奋斗;斗争;努力;挣扎;抗争;搏斗;艰难地行进,cet4,Many families struggle to make ends meet.,high
submit,提交;服从;屈从;呈递;递交;提出;使屈服,cet4,Please submit your application before the deadline.,high
succeed,成功;继承;接着发生;接替;继任;达到目的,cet4,If you work hard you will succeed.,high
sufficient,足够的;充分的;充足的;足够的;充分的;足量的,cet4,The evidence is not sufficient to prove his guilt.,high
suppose,假设;假定;认为;猜想;应该;期望;推测,cet4,I suppose you are right.,high
surface,表面;外观;地面;水面;浮出水面;在...上加表面;使...公开,cet4,The submarine surfaced near the island.,high
surround,围绕;包围;环绕;围住;圈住;环境;围绕物,cet4,The house is surrounded by a beautiful garden.,high
survive,幸存;存活;艰难度过;比...活得长;生存;活下来,cet4,Only a few passengers survived the crash.,high
