word,meaning,source,example,frequency
differentiate,区分;辨别;使不同,cet6,It is important to differentiate between fact and opinion.,medium
diffuse,扩散;弥漫;传播;分散,cet6,The light diffused through the frosted glass.,medium
digest,消化;领会;理解;摘要,cet6,It takes time to digest all this information.,high
digit,数字;位数;数位,cet6,The number 105 has three digits.,medium
digital,数字的;数码的;数字式的,cet6,The digital camera has replaced the film camera.,high
dignity,尊严;尊贵;高贵;庄严,cet6,She carried herself with great dignity.,high
dilemma,困境;进退两难;窘境,cet6,She faced the dilemma of choosing between career and family.,medium
diligent,勤奋的;勤勉的;用功的,cet6,The diligent student always completed his homework on time.,medium
dilute,稀释;冲淡;减弱;降低,cet6,You should dilute the juice with water.,medium
dim,昏暗的;暗淡的;模糊的,cet6,The dim light made it difficult to read.,medium
dimension,尺寸;维度;方面;范围,cet6,The project added a new dimension to our work.,high
diminish,减少;减小;降低;削弱,cet6,The value of the investment has diminished.,high
dine,用餐;进餐;宴请;款待,cet6,We dined at a fancy restaurant last night.,medium
dip,浸;蘸;浸染;下降;下沉,cet6,She dipped her brush into the paint.,high
diploma,毕业文凭;学位证书;执照,cet6,She received her diploma at the graduation ceremony.,medium
diplomat,外交官;外交家;有手腕的人,cet6,The diplomat negotiated a peace treaty.,medium
diplomatic,外交的;有手腕的;策略的,cet6,The ambassador used diplomatic language to avoid conflict.,medium
directory,目录;名录;指南;号码簿,cet6,Look up the number in the phone directory.,medium
disable,使丧失能力;使无效;禁用,cet6,The accident disabled him permanently.,medium
disadvantage,不利条件;劣势;缺点;缺陷,cet6,One disadvantage of city living is the high cost.,high
disagree,不同意;有分歧;不一致,cet6,I disagree with your conclusion.,high
disappear,消失;不见;失踪;消散,cet6,The sun disappeared behind the clouds.,high
disappoint,使失望;使扫兴;使沮丧,cet6,The results disappointed the team.,high
disaster,灾难;灾害;灾祸;大祸,cet6,The earthquake was a terrible disaster.,high
disastrous,灾难性的;极其糟糕的,cet6,The policy had disastrous consequences.,medium
discard,丢弃;抛弃;扔掉;废除,cet6,You should discard any expired medication.,medium
discharge,排放;释放;解雇;履行,cet6,The factory was fined for discharging waste into the river.,high
discipline,纪律;学科;训练;惩罚,cet6,Students must obey school discipline.,high
disclose,公开;揭露;透露;泄露,cet6,The company disclosed its financial reports.,medium
discount,折扣;打折;不考虑,cet6,The store offers a ten percent discount for students.,high
discourage,使气馁;使沮丧;劝阻,cet6,The difficult exam discouraged many students.,high
discrepancy,差异;不一致;不符合,cet6,There is a discrepancy between the two reports.,medium
discrete,离散的;分离的;独立的,cet6,The data consists of discrete values.,medium
discriminate,歧视;区别对待;辨别,cet6,It is illegal to discriminate based on gender.,high
discrimination,歧视;区别对待;辨别力,cet6,The law prohibits discrimination in the workplace.,high
disgrace,耻辱;丢脸;失宠;贬黜,cet6,The scandal brought disgrace to the family.,medium
disguise,伪装;假扮;掩饰;掩盖,cet6,The spy disguised himself as a tourist.,medium
disgust,厌恶;反感;憎恶;使厌恶,cet6,She expressed disgust at the violent scenes.,medium
dishonest,不诚实的;不老实的;欺诈的,cet6,The dishonest salesman tricked many customers.,medium
disillusion,使醒悟;使幻想破灭,cet6,Many young people are disillusioned with the system.,medium
dislike,不喜爱;厌恶;反感;讨厌,cet6,She has a strong dislike for spiders.,high
dismal,阴沉的;凄凉的;忧郁的,cet6,The team gave a dismal performance.,medium
dismantle,拆除;拆卸;解散;废除,cet6,The old factory was dismantled piece by piece.,medium
dismay,沮丧;灰心;惊慌;惊愕,cet6,"To her dismay, the store was already closed.",medium
dismiss,解散;解雇;开除;驳回,cet6,The boss dismissed the idea as impractical.,high
disorder,混乱;杂乱;失调;不适,cet6,The room was in complete disorder.,high
dispatch,派遣;发送;调度;调遣,cet6,The police dispatched officers to the scene.,medium
disperse,分散;散开;散布;驱散,cet6,The police used tear gas to disperse the crowd.,medium
displace,取代;替代;迫使离开,cet6,The war displaced millions of people.,medium
disposal,处理;处置;清除;安排,cet6,The city is responsible for waste disposal.,high
dispose,处理;处置;安排;布置,cet6,We need to dispose of the waste properly.,high
disposition,性情;性格;倾向;配置,cet6,She has a cheerful disposition.,medium
dispute,争论;争端;纠纷;争议,cet6,The dispute was finally resolved.,high
disregard,不理会;漠视;忽视,cet6,He completely disregarded the warning signs.,medium
disrupt,扰乱;中断;破坏;分裂,cet6,The storm disrupted the power supply.,medium
dissolve,溶解;解散;解除;消除,cet6,Sugar dissolves in water.,medium
distance,距离;远方;遥远;差距,cet6,What is the distance between the two cities?,high
distant,遥远的;远方的;疏远的,cet6,The distant mountains were covered in snow.,high
distinct,明显的;清晰的;不同的,cet6,There is a distinct improvement in his work.,high
distinction,区别;差别;优秀;荣誉,cet6,She earned the distinction of top student.,high
distinctive,有特色的;与众不同的,cet6,The building has a distinctive architectural style.,medium
distinguish,区分;辨别;使杰出,cet6,It is hard to distinguish between the twins.,high
distort,扭曲;歪曲;变形;曲解,cet6,The media distorted the facts.,medium
distract,分散注意力;使分心,cet6,The noise distracted her from her studies.,medium
distress,痛苦;忧虑;贫困;危难,cet6,The family was in great distress after the accident.,high
distribute,分配;分发;散布;配送,cet6,The organization distributes food to the poor.,high
distribution,分配;分发;分布;配送,cet6,The distribution of resources was unequal.,high
district,地区;区域;行政区;区,cet6,She lives in a residential district of the city.,high
disturb,打扰;干扰;使不安;扰乱,cet6,Please do not disturb me while I am working.,high
disturbance,干扰;扰乱;骚乱;不安,cet6,The disturbance was quickly brought under control.,medium
diverse,不同的;多样的;形形色色的,cet6,The city has a diverse population.,high
diversify,多样化;使多元化,cet6,The company diversified into new markets.,medium
diversion,转移;转向;消遣;绕行,cet6,The diversion led traffic away from the accident.,medium
diversity,多样性;差异;多元化,cet6,Cultural diversity enriches our society.,high
divert,转移;使转向;使消遣,cet6,The river was diverted to irrigate farmland.,medium
divide,分;划分;分割;除;分歧,cet6,The river divides the city into two parts.,high
dividend,红利;股息;回报;被除数,cet6,The company paid a high dividend to shareholders.,medium
divine,神的;神圣的;非凡的;预测,cet6,The ancient temple was a place of divine worship.,medium
division,部门;分开;分割;分歧;除法,cet6,The company has several divisions.,high
divorce,离婚;分离;分开,cet6,The couple divorced after years of conflict.,high
dizzy,头晕的;眩晕的;困惑的,cet6,The spinning ride made her feel dizzy.,medium
dome,圆屋顶;穹顶;圆顶状物,cet6,The cathedral has a magnificent dome.,medium
domestic,国内的;家庭的;驯养的,cet6,The domestic economy is growing steadily.,high
dominant,占优势的;主导的;统治的,cet6,She is the dominant figure in the company.,high
dominate,支配;主宰;在占优势,cet6,The team dominated the game from start to finish.,high
donate,捐赠;捐献;赠送,cet6,She donated a large sum to the charity.,high
donation,捐赠;捐款;捐赠物,cet6,Thank you for your generous donation.,high
doom,厄运;毁灭;注定;判定,cet6,The project was doomed to fail from the start.,medium
dose,剂量;一剂;一次用量,cet6,The doctor prescribed a low dose of medication.,medium
download,下载;下载的文件,cet6,You can download the software from our website.,high
draft,草稿;草案;汇票;征兵;起草,cet6,She wrote the first draft of the essay.,high
drain,排水;流干;消耗;枯竭,cet6,The water slowly drained out of the sink.,high
drainage,排水系统;排水;排水装置,cet6,The drainage system needs to be repaired.,medium
drama,戏剧;剧本;戏剧性事件,cet6,She studied drama at university.,high
dramatic,戏剧性的;巨大的;剧烈的,cet6,There has been a dramatic increase in sales.,high
drastic,激烈的;猛烈的;极端的,cet6,The government took drastic measures to control inflation.,medium
drawback,缺点;不利条件;障碍,cet6,The main drawback of the plan is the cost.,medium
dread,恐惧;畏惧;害怕;担忧,cet6,She dreaded the thought of speaking in public.,medium
dreadful,可怕的;糟糕的;极坏的,cet6,The weather was dreadful throughout the trip.,medium
drift,漂流;漂移;趋势;大意,cet6,The boat drifted slowly down the river.,medium
drought,干旱;旱灾;长期缺乏,cet6,The severe drought destroyed the crops.,medium
drum,鼓;鼓状物;敲击;击鼓,cet6,He played the drums in a rock band.,medium
dual,双的;双重的;两部分的,cet6,The device has a dual function.,medium
dubious,可疑的;靠不住的;怀疑的,cet6,The claim is based on dubious evidence.,medium
dumb,哑的;无言的;愚蠢的,cet6,She was struck dumb with amazement.,medium
dump,倾倒;丢弃;倾销;垃圾场,cet6,The company was fined for dumping waste illegally.,high
duplicate,复制;重复;副本;复制的,cet6,Please keep a duplicate of the document.,medium
durable,耐用的;持久的;长久的,cet6,The fabric is durable and long-lasting.,high
duration,持续时间;期间;期限,cet6,The duration of the course is six months.,high
dusk,黄昏;傍晚;薄暮,cet6,The street lights come on at dusk.,medium
dwell,居住;存在;细想;详述,cet6,They dwell in a remote village.,medium
dwelling,住宅;住所;寓所,cet6,The dwelling was made of stone and wood.,medium
dynamic,动态的;动力的;有活力的,cet6,The team has a dynamic leader.,high
dynasty,王朝;朝代;家族统治,cet6,The Ming dynasty ruled China for nearly 300 years.,medium
eager,渴望的;热切的;急切的,cet6,The children were eager to open their presents.,high
earnest,认真的;诚挚的;热心的,cet6,She made an earnest effort to improve her grades.,medium
earthquake,地震;大变动;大动荡,cet6,The earthquake measured 7.2 on the Richter scale.,high
ease,容易;舒适;放松;减轻,cet6,The medicine eased her pain.,high
Easter,复活节;复活节假期,cet6,We celebrate Easter with chocolate eggs.,medium
eccentric,古怪的;反常的;怪人,cet6,The eccentric millionaire lived in a castle.,medium
echo,回声;回响;共鸣;附和,cet6,The sound echoed through the cave.,medium
eclipse,日食;月食;黯然失色;超越,cet6,The solar eclipse was visible across the continent.,medium
ecology,生态;生态学;生态环境,cet6,The study of ecology helps us understand nature.,medium
economic,经济的;经济学的;赚钱的,cet6,The country is facing economic challenges.,high
economical,节约的;经济的;实惠的,cet6,The hybrid car is very economical on fuel.,high
economist,经济学家;经济学者,cet6,The economist predicted a recession.,medium
economy,经济;节约;理财;经济制度,cet6,The economy is growing at a steady pace.,high
ecosystem,生态系统;生态体系,cet6,The rainforest is a complex ecosystem.,medium
edge,边缘;刀刃;优势;锐利,cet6,The knife has a sharp edge.,high
edible,可食用的;可以吃的,cet6,The mushrooms are edible and delicious.,medium
edition,版本;版次;版;发行,cet6,The new edition of the book is now available.,high
editor,编辑;编者;主编;编辑程序,cet6,The editor corrected the grammar in the article.,high
editorial,编辑的;社论;社论的,cet6,The newspaper published an editorial on climate change.,medium
educate,教育;培养;训练;教导,cet6,The program aims to educate the public about health.,high
education,教育;培养;教育学;训练,cet6,Education is the key to success.,high
effect,效果;影响;作用;效应,cet6,The new law had a positive effect on the economy.,high
effective,有效的;生效的;实际的,cet6,The medicine is effective against the virus.,high
efficiency,效率;效能;功效;效益,cet6,We need to improve the efficiency of our production.,high
efficient,高效的;效率高的;有能力的,cet6,The new system is more efficient than the old one.,high
effort,努力;尽力;奋斗;成果,cet6,She put a lot of effort into the project.,high
elaborate,精心制作的;详尽的;阐述;精心制作,cet6,The scientist elaborated on his theory.,medium
elapse,消逝;过去;流逝,cet6,Several months elapsed before he heard from her.,medium
elastic,有弹性的;灵活的;弹性;松紧带,cet6,The rubber band is elastic.,medium
elbow,肘;肘部;肘状物;用肘推,cet6,She elbowed her way through the crowd.,medium
elderly,年长的;上年纪的;年老的,cet6,The elderly man walked slowly with a cane.,high
elect,选举;推选;选择;决定,cet6,The committee elected a new chairperson.,high
election,选举;当选;推举;竞选,cet6,The presidential election is held every four years.,high
electric,电的;用电的;电动的;电动的,cet6,The electric car is becoming more popular.,high
electrical,电的;与电有关的;电气科学的,cet6,He studied electrical engineering at university.,high
electrician,电工;电气技师;电学家,cet6,The electrician fixed the wiring problem.,medium
electricity,电;电力;电流;电能,cet6,The storm caused a power cut and we lost electricity.,high
electron,电子;微粒子,cet6,Electrons orbit the nucleus of an atom.,medium
electronic,电子的;电子设备的;电子学的,cet6,The device contains electronic components.,high
elegant,优雅的;高雅的;精美的;简练的,cet6,She wore an elegant dress to the ceremony.,high
element,元素;要素;成分;基本原理,cet6,Honesty is an essential element of character.,high
elementary,基本的;初级的;简单的;元素的,cet6,The students are learning elementary mathematics.,high
elevate,提升;举起;提高;晋升,cet6,The new job elevated her social status.,medium
elevator,电梯;升降机;升降舵,cet6,Take the elevator to the tenth floor.,high
eligible,有资格的;合格的;符合条件的,cet6,She is eligible for the scholarship.,medium
eliminate,消除;淘汰;排除;消灭,cet6,Regular exercise helps eliminate stress.,high
elite,精英;杰出人物;精锐的;优秀的,cet6,Only the elite were invited to the exclusive event.,high
eloquent,雄辩的;有口才的;有说服力的,cet6,She gave an eloquent speech at the ceremony.,medium
embargo,禁运;禁止贸易;限制;阻止,cet6,The trade embargo was lifted after negotiations.,low
embark,上船;上飞机;开始;着手,cet6,She embarked on a new career as a teacher.,medium
embarrass,使尴尬;使难堪;使困窘,cet6,The question embarrassed her.,medium
embassy,大使馆;大使馆全体人员,cet6,He works at the French embassy in Beijing.,medium
embed,嵌入;植入;使铭记;使深留,cet6,The bullet was embedded in the wall.,medium
embody,体现;包含;代表;使具体化,cet6,The statue embodies the spirit of the nation.,medium
embrace,拥抱;包含;欣然接受;信奉,cet6,She embraced the opportunity to study abroad.,high
emerge,出现;浮现;显露;兴起,cet6,New evidence has emerged in the case.,high
emergency,紧急情况;突发事件;急诊,cet6,"In case of emergency, call 911.",high
emigrate,移民;移居国外;迁徙,cet6,They emigrated to Canada for a better life.,medium
emission,排放;排放物;散发;发射,cet6,The car produces low carbon emissions.,high
emit,发出;排放;发射;散发,cet6,The volcano emitted clouds of ash.,medium
emotion,情感;情绪;感情;感动,cet6,The movie evokes strong emotions in the audience.,high
emotional,情感的;情绪的;感人的;易激动的,cet6,She gave an emotional speech at the wedding.,high
emperor,皇帝;帝王;君主,cet6,The emperor ruled the vast empire.,medium
emphasis,强调;重点;重要性;重读,cet6,The school places great emphasis on academic achievement.,high
emphasize,强调;着重;突出;重读,cet6,The report emphasizes the need for reform.,high
empire,帝国;大企业;王朝;帝权,cet6,The Roman empire lasted for centuries.,high
empirical,经验的;经验主义的;以观察为依据的,cet6,The study provides empirical evidence.,medium
employ,雇用;使用;利用;运用,cet6,The company employs over 5000 people.,high
employee,雇员;员工;受雇者;职工,cet6,The employees went on strike for better wages.,high
employer,雇主;老板;雇佣者;使用者,cet6,Her employer offered her a promotion.,high
employment,就业;雇用;工作;职业,cet6,She found employment at a law firm.,high
empower,授权;赋予权力;使能够;增加自主权,cet6,The new law empowers women to seek justice.,medium
enable,使能够;使可能;启用;授权,cet6,This scholarship enabled me to attend university.,high
enclose,围绕;围住;附上;装入,cet6,Please enclose a copy of your resume.,medium
encompass,包含;包括;围绕;覆盖,cet6,The project encompasses many different areas.,medium
encounter,遭遇;遇到;邂逅;面临,cet6,She encountered many difficulties along the way.,high
encourage,鼓励;激励;促进;支持,cet6,Parents should encourage their children to read.,high
endanger,危及;危害;使濒危,cet6,Pollution endangers many species of wildlife.,medium
endeavor,努力;尽力;尝试;事业,cet6,She endeavored to finish the project on time.,medium
endorse,支持;赞同;背书;代言,cet6,The celebrity endorsed the new product.,medium
endow,捐赠;资助;赋予;天赋,cet6,She was endowed with great musical talent.,medium
endurance,忍耐;耐力;持久;耐久性,cet6,The marathon is a test of endurance.,high
endure,忍受;忍耐;持续;坚持,cet6,The pain was hard to endure.,high
energetic,精力充沛的;积极的;充满活力的,cet6,The children are very energetic and playful.,high
energy,能量;能源;精力;活力,cet6,Solar energy is a clean and renewable source.,high
enforce,执行;实施;强制;强迫,cet6,The police enforce the law.,medium
engage,参与;从事;吸引;雇佣,cet6,The speaker engaged the audience with his stories.,high
engagement,订婚;约会;参与;交战,cet6,The engagement was announced in the newspaper.,medium
engine,发动机;引擎;机车;火车头,cet6,The car engine needs to be repaired.,high
engineer,工程师;设计师;技师;策划,cet6,She works as a software engineer.,high
engineering,工程;工程学;设计;规划,cet6,He studied civil engineering at college.,high
enhance,增强;提高;美化;提升,cet6,Regular exercise enhances your overall health.,high
enlarge,扩大;放大;扩展;增大,cet6,We need to enlarge the house to accommodate more people.,medium
enlighten,启发;启迪;启蒙;教导,cet6,The book enlightened me on many issues.,medium
enormous,巨大的;庞大的;极大的,cet6,The enormous building dominated the skyline.,high
enrich,丰富;充实;使富裕;浓缩,cet6,Travel enriches our understanding of the world.,high
enroll,注册;登记;入学;参加,cet6,She enrolled in a French language course.,medium
ensure,确保;保证;担保;保护,cet6,Please ensure that all doors are locked before leaving.,high
enterprise,企业;事业;进取心;公司,cet6,Small and medium enterprises are important for the economy.,high
entertain,招待;使娱乐;使快乐;怀有,cet6,The magician entertained the children.,high
entertainment,娱乐;娱乐活动;招待;表演,cet6,The city offers many entertainment options.,high
enthusiasm,热情;热心;热忱;热爱,cet6,Her enthusiasm for teaching is contagious.,high
enthusiastic,热情的;热心的;热烈的,cet6,She was enthusiastic about the new project.,high
entire,整个的;全部的;完整的;完全的,cet6,She spent the entire day reading.,high
entitle,使有资格;使有权;给...命名,cet6,The coupon entitles you to a free drink.,medium
entity,实体;整体;独立存在物,cet6,The company is a separate legal entity.,medium
entrepreneur,企业家;创业者;主办人,cet6,The young entrepreneur started his own business.,medium
entry,进入;入口;条目;登记;参赛,cet6,The thief gained entry through the window.,high
environment,环境;周围;生态环境;氛围,cet6,We must protect the environment for future generations.,high
environmental,环境的;有关环境的;环保的,cet6,Environmental protection is a global issue.,high
epidemic,流行病;传染病;蔓延;泛滥,cet6,The government took measures to control the epidemic.,medium
episode,一集;一段经历;片段;插曲,cet6,The final episode of the series airs tonight.,medium
equal,相等的;平等的;同等的;等于,cet6,All people are equal under the law.,high
equality,平等;相等;均等;公平,cet6,The fight for gender equality continues.,high
equation,方程;等式;均衡;相等,cet6,She solved the equation in just three minutes.,medium
equip,装备;配备;使具备;训练,cet6,The students are equipped with the necessary skills.,high
equipment,设备;装备;器材;装置,cet6,The laboratory has state-of-the-art equipment.,high
equivalent,等价的;相等的;等同物;等价物,cet6,A dollar is roughly equivalent to seven yuan.,high
era,时代;纪元;年代;时期,cet6,We are living in the digital era.,high
erode,侵蚀;腐蚀;削弱;逐步破坏,cet6,The coastline has been eroded by the sea.,medium
erosion,侵蚀;腐蚀;削弱;风化,cet6,Soil erosion is a serious problem in the region.,medium
error,错误;差错;失误;缺陷,cet6,The computer program contained an error.,high
erupt,爆发;喷发;突然发生;发疹,cet6,The volcano erupted after years of dormancy.,medium
escalate,升级;加剧;扩大;逐步上升,cet6,The conflict escalated into a full-scale war.,medium
escape,逃跑;逃脱;逃避;漏出,cet6,The prisoner escaped from the jail.,high
escort,护送;陪同;护卫;护航,cet6,The president was escorted by security guards.,medium
especially,特别;尤其;格外;特意,cet6,"I love flowers, especially roses.",high
essay,散文;文章;论文;随笔,cet6,She wrote an essay on climate change.,high
essence,本质;实质;精华;精髓,cet6,The essence of the problem is lack of trust.,high
essential,基本的;必要的;本质的;必需品,cet6,Water is essential for life.,high
establish,建立;设立;确立;安置,cet6,The company was established in 1990.,high
establishment,建立;设立;确立;机构,cet6,The establishment of the new law took months.,high
estate,地产;财产;遗产;庄园,cet6,She inherited a large estate from her grandfather.,high
estimate,估计;估价;评估;估算,cet6,The cost is estimated at one million dollars.,high
eternal,永恒的;永远的;不朽的;永久的,cet6,The couple promised eternal love.,medium
ethical,道德的;伦理的;合乎道德的,cet6,The company follows strict ethical standards.,medium
ethnic,种族的;民族的;异国情调的,cet6,The city has a diverse ethnic population.,high
evacuate,疏散;撤离;撤出;转移,cet6,The residents were evacuated before the hurricane.,medium
evaluate,评估;评价;估值;评定,cet6,The teacher will evaluate your performance.,high
evaluation,评估;评价;评定;估价,cet6,The evaluation of the project was positive.,high
evaporate,蒸发;消失;使蒸发;使消失,cet6,The water evaporated under the hot sun.,medium
eve,前夕;前夜;前夕;傍晚,cet6,The party was held on New Year Eve.,medium
evening,晚上;傍晚;晚会;晚间,cet6,She studied for the exam all evening.,high
event,事件;大事;活动;项目;结果,cet6,The conference was a major event in the industry.,high
eventually,最终;终于;最后;结果,cet6,She eventually passed the exam after many attempts.,high
everlasting,永久的;永恒的;持久的;持续不断的,cet6,The beauty of nature is everlasting.,medium
evidence,证据;迹象;证明;根据,cet6,There is strong evidence that smoking causes cancer.,high
evident,明显的;明白的;显然的;清楚的,cet6,It was evident that she was unhappy.,high
evil,邪恶的;有害的;邪恶;罪恶;祸害,cet6,The evil villain was finally defeated.,high
evoke,唤起;引起;召唤;引发,cet6,The smell evoked childhood memories.,medium
evolution,进化;演变;发展;演进,cet6,The theory of evolution explains the origin of species.,high
evolve,进化;演变;发展;进展,cet6,Species evolve over millions of years.,high
exact,精确的;准确的;确切的;精密的,cet6,Please give me the exact measurements.,high
exaggerate,夸张;夸大;言过其实,cet6,He exaggerated the story to make it more interesting.,medium
examination,考试;检查;审查;体检,cet6,The final examination will be held next week.,high
examine,检查;考试;审视;调查,cet6,The doctor examined the patient thoroughly.,high
example,例子;榜样;范例;样本,cet6,She set a good example for her younger sister.,high
exceed,超过;超越;胜过;超出,cet6,The cost exceeded our budget.,high
exceedingly,非常;极其;格外;特别地,cet6,The task was exceedingly difficult.,medium
excellent,优秀的;卓越的;杰出的;极好的,cet6,She received excellent grades on all her exams.,high
exception,例外;除外;异议;反对,cet6,Everyone must obey the rules without exception.,high
exceptional,例外的;杰出的;卓越的;特殊的,cet6,She is an exceptional student.,high
excerpt,摘录;节选;选录;摘要,cet6,The newspaper published an excerpt from the book.,medium
excess,过量;过剩;超过;额外的;附加的,cet6,Avoid excess consumption of sugar.,high
excessive,过度的;过分的;极度的;过多的,cet6,The excessive rain caused flooding.,high
