word,meaning,source,example,frequency
reputation,名誉;名声;声望;信誉;声誉;好名声,cet6,She has a reputation for honesty.,high
request,请求;要求;申请;恳求;邀请;请求;要求,cet6,Your request has been approved.,high
require,需要;要求;命令;规定;需要;需求,cet6,This job requires a lot of patience.,high
requirement,要求;必要条件;需要;需要的东西;规定,cet6,The requirements for the job are listed.,high
rescue,营救;救援;解救;救助;救援;营救,cet6,The lifeguard rescued the drowning child.,high
research,研究;调查;探索;探究;研究工作,cet6,She is conducting research on climate change.,high
researcher,研究员;调查者;科研人员;学术研究者,cet6,The researcher published her findings.,high
resemblance,相似;相似之处;类似;相似性;相似程度,cet6,There is a strong resemblance between the two sisters.,medium
resemble,像;类似;相似;相似于;类似于;与相似,cet6,She resembles her mother.,high
resent,怨恨;憎恶;愤恨;对感到愤慨;不满,cet6,She resented his interference.,medium
reservation,保留;预订;预约;疑虑;保留意见;自然保护区,cet6,I have a reservation at the hotel.,high
reserve,保留;预订;储备;保护区;矜持;保存,cet6,I would like to reserve a table for two.,high
reservoir,水库;蓄水池;储液器;储藏;储备;积蓄,cet6,The reservoir supplies water to the city.,medium
reside,居住;定居;存在;在于;属于;归于,cet6,She resides in the countryside.,high
residence,住宅;住所;居住;居留;居住时间;官邸,cet6,The president official residence is the White House.,high
resident,居民;住户;住院医生;居住的;常驻的,cet6,The local residents protested the new development.,high
residential,住宅的;居住的;适合居住的;住宅区的,cet6,This is a quiet residential neighborhood.,high
resign,辞职;辞去;放弃;委托;顺从;使听从,cet6,She resigned from her position as director.,high
resignation,辞职;辞呈;放弃;顺从;听从;听任,cet6,He submitted his resignation letter.,high
resist,抵抗;抵制;反抗;抗拒;忍住;阻挡,cet6,She could not resist the temptation to buy the dress.,high
resistance,抵抗;反抗;抵制;阻力;电阻;抗力,cet6,The army put up strong resistance.,high
resistant,抵抗的;对抗的;有抵抗力的;耐...的,cet6,The material is water-resistant.,high
resolution,分辨率;决议;决定;决心;解决;分解;解析,cet6,She made a New Year resolution to exercise more.,high
resolve,解决;决定;决心;决议;分解;解析;表决,cet6,They resolved the conflict peacefully.,high
resort,度假胜地; resort; resort; resort; resort,cet6,They went to a beach resort for vacation.,high
resource,资源;财力;智谋;策略;资料;来源,cet6,The country is rich in natural resources.,high
respect,尊重;尊敬;方面;敬意;问候;遵守;重视,cet6,She deserves respect for her hard work.,high
respectable,可敬的;体面的;像样的;高尚的;相当好的,cet6,She comes from a respectable family.,high
respectful,尊敬的;恭敬的;有礼貌的;充满敬意的,cet6,Be respectful to your elders.,high
respective,各自的;分别的;各个的;各别的;分别的,cet6,They returned to their respective homes.,high
respond,回答;反应;响应;回应;应答;回复,cet6,The company responded quickly to customer complaints.,high
response,回答;反应;响应;回应;应答;答复,cet6,Her response was immediate.,high
responsibility,责任;职责;义务;负责任;责任心;责任感,cet6,She has a lot of responsibility at work.,high
responsible,负责的;有责任的;可靠的;责任重大的,cet6,Who is responsible for this mistake?,high
rest,休息;剩余部分;其余;支撑物;放置;使休息,cet6,She rested after the long journey.,high
restless,不安的;焦虑的;不安静的;静不下来的,cet6,The restless child could not sit still.,high
restoration,恢复;复原;修复;归还;复位;复职;复辟,cet6,The restoration of the painting took months.,medium
restore,恢复;修复;复原;归还;使恢复;使复原,cet6,The building was restored to its original condition.,high
restrain,抑制;克制;阻止;束缚;限制;控制;约束,cet6,She could not restrain her anger.,high
restraint,抑制;克制;限制;束缚;约束;拘束;节制,cet6,He showed great restraint in not responding to the insult.,high
restrict,限制;约束;限定;控制;制约;禁止,cet6,The new law restricts the sale of alcohol.,high
restriction,限制;约束;限定;制约;管制;限定条件,cet6,There are restrictions on parking in the city.,high
result,结果;成绩;成果;效果;比分;结果;发生,cet6,The test results were excellent.,high
resume,恢复;继续;重新开始;简历;履历;摘要,cet6,She submitted her resume for the job.,high
retail,零售;零售的;零售的;零售价;零售,cet6,The product is sold in retail stores.,high
retailer,零售商;零售店;零售商人;零售业者,cet6,The retailer sells clothes and accessories.,medium
retain,保持;保留;维持;保存;记住;聘用;留任,cet6,The old building retained its original charm.,high
retaliate,报复;反击;以牙还牙;回报;复仇;回击,cet6,The company retaliated by raising prices.,medium
retire,退休;退役;退出;退下;退隐;就寝;收回,cet6,She retired at the age of 65.,high
retirement,退休;退役;退隐;退职;退休生活;退休金,cet6,She is enjoying her retirement.,high
retreat,撤退;退却;退缩;撤退;退出;隐居;静修,cet6,The army retreated from the battlefield.,high
retrieve,取回;找回;恢复;挽回;检索;补偿;拯救,cet6,She retrieved the file from the computer.,high
retrospect,回顾;回想;追溯;回首;反省;在 retrospect 中,cet6,"In retrospect, I should have told the truth.",medium
reveal,揭示;透露;显示;泄露;展现;揭露;启示,cet6,The investigation revealed the truth.,high
revelation,揭示;揭露;透露;显示;泄露;启示;被暴露的真相,cet6,The revelation shocked everyone.,medium
revenge,报仇;报复;复仇;雪耻;报复行为;报复心,cet6,He sought revenge for the insult.,medium
revenue,收入;税收;收益;财政收入;税务;营收,cet6,The company revenue increased by 20 percent.,high
reverse,相反的;反向的;颠倒的;倒车;反转;逆转;背面,cet6,The car reversed into the parking space.,high
review,评审;评论;回顾;复习;检讨;检阅;审查,cet6,The book received positive reviews.,high
revise,修订;修改;修正;复习;温习;校订;修正,cet6,The textbook was revised for the new edition.,high
revision,修订;修改;修正;复习;温习;校订;修正案,cet6,The revision of the document is necessary.,high
revive,复活;复苏;复兴;恢复;苏醒;使复兴;使恢复,cet6,The economy is beginning to revive.,high
revolt,反抗;起义;反叛;造反;叛逆;叛变;反抗,cet6,The people revolted against the dictator.,medium
revolution,革命;革命性变革;旋转;绕转;公转;循环,cet6,The industrial revolution changed society.,high
revolutionary,革命的;革命性的;突破性的;革命者;革命家,cet6,The revolutionary idea changed the world.,high
revolve,旋转;环绕;绕转;围绕;以...为中心,cet6,The earth revolves around the sun.,high
reward,奖励;报酬;奖赏;悬赏金;回报;酬谢;酬劳,cet6,She received a reward for finding the lost dog.,high
rhetoric,修辞;修辞学;花言巧语;浮夸的语言;演讲技巧,cet6,The politician speech was full of rhetoric.,medium
rhythm,节奏;韵律;节拍;规律;节律;有规律的变化,cet6,She danced to the rhythm of the music.,high
rib,肋骨;肋条;排骨;肋状物;伞骨;嘲笑;取笑,cet6,He broke a rib in the accident.,medium
ribbon,缎带;丝带;带子;带状物;饰带;勋章;绶带,cet6,She tied a ribbon in her hair.,high
rid,摆脱;去掉;解除;免除;清除;消除;使摆脱,cet6,She rid the house of pests.,high
riddle,谜语;谜;谜团;莫名其妙的事;筛子;粗筛;筛,cet6,The riddle was difficult to solve.,medium
ridge,脊;山脊;屋脊;脊背;脊状突起;垄;埂,cet6,The ridge of the mountain is visible from afar.,medium
ridiculous,可笑的;荒谬的;滑稽的;荒唐的;离谱的,cet6,That is a ridiculous idea.,high
rifle,步枪;来福枪;步枪;来复枪;抢夺;偷窃,cet6,The soldier carried a rifle.,high
rigid,僵硬的;僵直的;严格的;刻板的;死板的;刚性的,cet6,She follows a rigid schedule.,high
rigorous,严格的;严厉的;严密的;精确的;严酷的,cet6,The research underwent rigorous testing.,medium
rim,边缘;边;轮缘;框;边框;环状边缘;镶边,cet6,The rim of the cup is chipped.,medium
riot,骚乱;暴动;暴乱;狂欢;喧闹;极度丰富,cet6,The riot was quelled by the police.,medium
rip,撕;扯;裂开;撕裂;撕破;裂缝;裂口;快速移动,cet6,She ripped the paper in half.,high
ripe,成熟的;时机成熟的;准备好的;醇美的;老练的,cet6,The fruit is ripe.,high
ripple,涟漪;波纹;细浪;波动;使起涟漪;使起波纹,cet6,The stone caused ripples in the water.,medium
risk,风险;危险;冒险;危险人物;危险因素;冒风险,cet6,There is a risk of fire.,high
risky,有风险的;危险的;冒险的;有危险的;大胆的,cet6,The investment is risky.,high
ritual,仪式;典礼;程序;习惯;惯例;仪式的;例行的,cet6,The wedding ritual was beautiful.,medium
rival,竞争对手;对手;竞争者;匹敌者;竞争的;对抗的,cet6,The two companies are rivals in the market.,high
roar,吼叫;咆哮;轰鸣;喧闹;大声喊叫;大笑;使轰鸣,cet6,The lion roared loudly.,high
roast,烤;烘;焙;炙烤;烤的;烘的;烤制的;烤;烤肉,cet6,We had roast chicken for dinner.,high
rob,抢劫;盗取;剥夺;使丧失;抢夺;劫掠;偷盗,cet6,The thieves robbed the bank.,high
robbery,抢劫;盗窃;抢劫案;盗窃案;掠夺,cet6,The robbery occurred at midnight.,high
robe,长袍;礼服;浴袍;睡袍;法衣;官服;覆盖,cet6,She wore a silk robe.,medium
robot,机器人;自动机;遥控装置;自动控制机械,cet6,The robot performs repetitive tasks.,high
robust,强壮的;健壮的;坚强的;结实的;耐用的;坚定的,cet6,The company has a robust financial position.,high
rocket,火箭;火箭弹;导弹;火箭推进器;迅速上升;猛涨,cet6,The rocket was launched into space.,high
rod,杆;棒;竿;棍棒;钓竿;标尺;杆状物;避雷针,cet6,He used a fishing rod to catch the fish.,high
role,角色;作用;职责;地位;任务;功能;职能,cet6,She played an important role in the project.,high
roll,卷;滚;滚动;卷起;打滚;碾;辗;卷饼;卷轴;名册,cet6,She rolled the dough into a ball.,high
roller,滚筒;滚轴;滚柱;滚轮;滚轧机;压路机;卷发器,cet6,The roller coaster was thrilling.,medium
romance,浪漫;爱情;恋爱;浪漫史;爱情故事;浪漫情调,cet6,They had a whirlwind romance.,high
romantic,浪漫的;爱情的;恋爱的;浪漫主义的;传奇的,cet6,The movie is a romantic comedy.,high
roof,屋顶;顶部;车顶;房顶;最高点;遮盖;遮蔽,cet6,The roof of the house is red.,high
root,根;根部;根源;起源;基础;根本;根源;使生根,cet6,The root of the problem is lack of communication.,high
rope,绳子;绳索;粗绳;绞索;一串;约束;捆绑,cet6,She tied the rope around the tree.,high
rose,玫瑰;蔷薇;玫瑰花;玫瑰色;玫瑰红;玫瑰形的,cet6,He gave her a dozen red roses.,high
rot,腐烂;腐坏;腐朽;腐败;堕落;逐渐衰败;使腐烂,cet6,The food began to rot in the sun.,medium
rotary,旋转的;转动的;循环的;轮式的;旋转式的,cet6,The rotary engine is different from the piston engine.,medium
rotate,旋转;转动;轮流;交替;使旋转;使转动;使轮流,cet6,The earth rotates on its axis.,high
rotation,旋转;转动;轮流;交替;循环;旋度;轮作,cet6,The rotation of the earth causes day and night.,high
rotten,腐烂的;发臭的;腐朽的;腐败的;堕落的;极坏的,cet6,The fruit went rotten.,high
rough,粗糙的;不平的;粗鲁的;粗略的;大致的;艰难的,cet6,She had a rough day at work.,high
round,圆的;球形的;圆形的;完整的;整数的;周围,cet6,The table is round.,high
roundabout,绕道的;迂回的;委婉的;不直接的;旋转木马;环状交叉路,cet6,The explanation was a roundabout way of saying no.,medium
rouse,唤醒;唤起;鼓舞;激励;使觉醒;使奋起,cet6,The alarm roused them from sleep.,medium
route,路线;路途;航线;道路;途径;发送;按路线发送,cet6,We took the scenic route home.,high
routine,惯例;常规;例行公事;日常的;例行的;平淡的,cet6,She follows her daily routine.,high
row,排;行;划船;划行;争吵;吵架;纠纷;成排;排列,cet6,They sat in the front row.,high
royal,皇家的;王室的;国王的;女王的;高贵的;盛大的,cet6,The royal family attended the ceremony.,high
royalty,王族;皇室;版税;专利权税;王权;王位;王族成员,cet6,The author earns royalties from book sales.,medium
rub,擦;摩擦;揉;搓;擦亮;涂;抹;磨损;擦破;擦伤;困难,cet6,She rubbed her tired eyes.,high
rubber,橡胶;橡皮;橡胶制品;橡胶的;橡皮的;橡胶制的,cet6,The tires are made of rubber.,high
rubbish,垃圾;废物;废话;胡说;荒谬的想法;劣质的东西,cet6,The rubbish is collected on Tuesdays.,high
rude,粗鲁的;无礼的;突然的;猛烈的;粗暴的;野蛮的;简陋的,cet6,It is rude to interrupt.,high
rug,小地毯;炉边地毯;厚地毯;毯子;毛毯;假发,cet6,She placed a rug in front of the fireplace.,medium
ruin,毁灭;破坏;废墟;遗迹;破产;堕落;使毁灭;使破产;毁坏,cet6,The fire ruined the historic building.,high
rule,规则;规定;统治;管理;支配;尺;直尺;控制;裁定;统治,cet6,The rules are clearly stated.,high
ruler,统治者;管理者;直尺;尺;支配者;领导者;用尺量,cet6,The ruler measured the length of the table.,high
rumor,谣言;传闻;流言;传说;谣传;传闻;流传,cet6,The rumor spread quickly through the office.,high
run,跑;跑步;奔跑;运行;经营;管理;运转;行驶;流动;竞选;变;变成;逃跑,cet6,She runs every morning.,high
rural,农村的;乡下的;田园的;乡村的;农业的;乡村生活的,cet6,She prefers rural life to city life.,high
rush,冲;奔;匆忙;赶紧;催促;仓促;冲进;突袭;急促的动作;匆忙;热潮,cet6,She rushed to catch the train.,high
rust,锈;铁锈;锈色;锈病;生锈;使生锈;长锈;氧化;变成铁锈色;衰退,cet6,The metal gate had rusted badly.,medium
rustle,沙沙作响;发出窸窣声;使沙沙作响;沙沙声;窸窣声;急忙行动,cet6,The leaves rustled in the wind.,medium
rut,车辙;凹槽;常规;惯例;老一套;发情期;发情;形成车辙;使固定模式,cet6,She felt stuck in a rut at her job.,medium
ruthless,残忍的;无情的;冷酷的;毫不留情的;坚决的;彻底的,cet6,The dictator was a ruthless tyrant.,medium
sack,麻袋;袋子;解雇;开除;劫掠;洗劫;把...装入袋;抢夺;开除,cet6,He was given the sack for being late.,high
sacred,神圣的;宗教的;庄严的;不可侵犯的;受崇敬的;献给的,cet6,The temple is a sacred place.,high
sacrifice,牺牲;献祭;祭品;牺牲品;亏本出售;献出;牺牲;献祭,cet6,She sacrificed her career for her family.,high
sad,悲伤的;难过的;悲哀的;令人伤心的;可怜的;糟糕的;暗淡的,cet6,She felt sad after the movie ended.,high
saddle,鞍;马鞍;车座;鞍状物;给装上鞍;使负担;承受;承受负担,cet6,She saddled her horse and rode away.,medium
sadness,悲伤;伤心;悲哀;悲痛;难过;忧伤;令人悲伤的事物,cet6,The sadness in her voice was evident.,high
safe,安全的;平安的;保险的;可靠的;谨慎的;保险箱;安全的地方,cet6,Keep your money in a safe place.,high
safety,安全;平安;保险;安全设备;安全场所;安全性;保安,cet6,Safety is the first priority.,high
sail,帆;航行;乘船航行;起航;驾驶船只;航行;帆船;航行旅程,cet6,The ship will sail at dawn.,high
sailor,水手;海员;船员;水兵;乘船者;航海者;经常乘船旅行的人,cet6,The sailor had been at sea for months.,medium
saint,圣人;圣徒;圣;神圣的人;道德高尚的人;天使般的人,cet6,Saint Francis is the patron saint of animals.,medium
sake,缘故;理由;目的;利益;为了...起见; sake,cet6,"For the sake of your health, you should quit smoking.",high
salad,色拉;沙拉;凉拌菜;生菜;色拉菜,cet6,She ordered a green salad for lunch.,high
salary,薪水;薪金;工资;年薪;月薪;给...薪水,cet6,She earns a good salary as a lawyer.,high
sale,销售;出售;销售额;降价出售;拍卖;销路;上市,cet6,The house is for sale.,high
salesman,售货员;推销员;店员;销售员;业务员,cet6,The salesman showed us the new model.,medium
salt,盐;食盐;盐类;盐的;咸的;加盐;用盐腌;给...加盐,cet6,Please pass me the salt.,high
salute,敬礼;致敬;行礼;鸣礼炮;赞扬;颂扬;敬礼;致敬;礼炮,cet6,The soldiers saluted the general.,medium
salvation,拯救;解救;救星;救助;救世;救赎;灵魂的超度,cet6,The donation was their salvation from poverty.,medium
same,相同的;同样的;同一的;无变化的;千篇一律的;同样的事物,cet6,They are wearing the same dress.,high
sample,样品;样本;标本;抽样;取样;尝试;体验;品尝,cet6,The store gave out free samples of the product.,high
sanction,批准;认可;制裁;处罚;许可;支持;鼓励;授权;对...实施制裁,cet6,The UN imposed economic sanctions on the country.,high
sand,沙;沙子;沙滩;沙地;沙粒;沙色;用沙擦;铺沙;撒沙,cet6,The children played in the sand.,high
sandwich,三明治;夹心面包;夹心饼;夹在一起;挤入;插入,cet6,She ate a sandwich for lunch.,high
sane,神志正常的;头脑清楚的;明智的;理智的;合情合理的;健全的,cet6,No sane person would do such a thing.,medium
sarcasm,讽刺;挖苦;嘲笑;讥讽;冷嘲热讽;讽刺语;讽刺性,cet6,His voice dripped with sarcasm.,medium
satellite,卫星;人造卫星;卫星国;卫星城镇;随从;附属的,cet6,The satellite orbits the Earth.,high
satisfaction,满意;满足;满足感;令人满意的事;赔偿;偿还;报复,cet6,She expressed satisfaction with the results.,high
satisfactory,令人满意的;符合要求的;良好的;可以的;适当的,cet6,The work was satisfactory.,high
satisfy,满足;使满意;符合;达到;满足要求;使信服;使确信;清偿,cet6,The product satisfies the needs of most customers.,high
saturate,浸透;渗透;使饱和;使充满;使充分吸收;使市场饱和,cet6,The market is saturated with similar products.,medium
sauce,酱;酱油;调味汁;沙司;酱汁;佐料;有礼貌的冒失;莽撞,cet6,The pasta is served with tomato sauce.,high
saucer,碟子;茶托;浅碟;浅盘;碟状物;碟形;飞碟,cet6,She placed the cup on the saucer.,medium
sausage,香肠;腊肠;肉肠;肠状物;香肠状的,cet6,She grilled sausages for the barbecue.,medium
savage,野蛮的;未开化的;凶猛的;残忍的;猛烈的;强烈的;野蛮人;粗暴的人,cet6,The savage storm destroyed the village.,medium
save,拯救;救;节省;节约;储存;保存;保留;挽救;储蓄;保全,cet6,She saved money for her vacation.,high
saving,储蓄;节省;节约;存款;储蓄金;挽救;救助;保留;节俭的,cet6,She opened a savings account at the bank.,high
saw,锯;锯子;锯床;谚语;格言;锯;拉锯;锯开;来回移动;see的过去式,cet6,He sawed the branch off the tree.,high
scale,规模;刻度;比例;等级;范围;天平;鳞片;按比例缩放,cet6,The company operates on a global scale.,high
scan,扫描;浏览;细看;审视;扫描检查;扫描;浏览;扫描;掠射,cet6,She scanned the document into the computer.,high
scandal,丑闻;丑事;丑行;流言蜚语;诽谤;耻辱;反感;愤慨,cet6,The scandal ruined his political career.,high
scar,伤疤;疤痕;伤痕;创伤;精神上的创伤;留下伤痕;结疤;愈合,cet6,The accident left a scar on his face.,medium
scare,使害怕;惊吓;受惊;惊恐;恐慌;恐惧;吓唬;惊吓;惊恐,cet6,The loud noise scared the children.,high
scatter,散开;分散;散布;撒;驱散;消散;散射;分散;散布;驱散,cet6,She scattered flower seeds in the garden.,high
scene,场景;场面;现场;景色;景象;发生地点;事件;发脾气,cet6,The crime scene was cordoned off.,high
scenery,风景;景色;风光;舞台布景;背景;景观;全部景色,cet6,The scenery in the mountains is breathtaking.,high
scent,气味;香味;香气;嗅觉;线索;迹象;香水;使充满气味;嗅到;察觉,cet6,The scent of roses filled the garden.,high
schedule,日程;时间表;计划;排程;安排;时刻表;预定;安排,cet6,The flight is on schedule.,high
scheme,计划;方案;阴谋;诡计;体系;结构;图谋;策划;设计,cet6,The scheme was designed to help the poor.,high
scholar,学者;奖学金获得者;有学问的人;学生;学习者;受教育者,cet6,The scholar published a book on ancient history.,high
scholarship,奖学金;学问;学识;学术成就;学术研究;学者身份,cet6,She won a scholarship to study abroad.,high
school,学校;学院;上学;学校教育;学派;流派;鱼群;群;教育;训练,cet6,She goes to school by bus.,high
science,科学;自然科学;理科;学问;学科;科学研究;科技,cet6,Science and technology are advancing rapidly.,high
scientific,科学的;科学上的;系统性的;精确的;符合科学规律的,cet6,The research is based on scientific methods.,high
scientist,科学家;科学工作者;科学研究者;自然科学家,cet6,The scientist made a breakthrough discovery.,high
scissors,剪刀;剪子;剪刀式;剪式跳高;剪式;剪断,cet6,She cut the paper with scissors.,medium
scold,责骂;斥责;责备;训斥;骂;申斥;数落,cet6,The mother scolded her son for being late.,high
scope,范围;机会;余地;视野;能力;领域;导弹射程;查明;审视,cet6,The scope of the project is very broad.,high
score,得分;分数;成绩;比分;乐谱;二十;刻痕;得分;评分;获得;刻划,cet6,She scored the winning goal.,high
scorn,鄙视;轻蔑;不屑;嘲笑;讽刺;表示轻蔑;不屑做;蔑视;嘲笑,cet6,She scorned his offer of help.,medium
scout,侦察员;侦察兵;童子军;物色人才的人;侦察;搜索;物色;寻找,cet6,The scout reported the enemy position.,medium
scramble,爬;攀登;争夺;抢;使混乱;炒蛋;快速爬行;攀登;混乱;争夺,cet6,The hikers scrambled up the steep slope.,medium
scrap,碎片;废料;废金属;少量;点滴;废弃;抛弃;报废;打架;争吵,cet6,The car was sold for scrap.,medium
scrape,刮;擦;削;刮掉;擦伤;擦过;挖空;刮擦声;刮痕;擦伤;困境,cet6,She scraped her knee on the pavement.,medium
scratch,抓;搔;划;划破;刮擦;抓伤;刮痕;起跑线;抓痕;挠;刮擦声,cet6,The cat scratched the furniture.,high
scream,尖叫;喊叫;大声说;高声喊叫;尖叫;大喊大叫;引人注目的人,cet6,She screamed when she saw the spider.,high
screen,屏幕;银幕;屏风;隔板;筛查;筛选;审查;遮蔽;庇护;放映,cet6,She looked at the computer screen.,high
screw,螺丝;螺钉;螺丝钉;螺旋桨;拧;旋;扭;拧紧;旋紧;固定;欺骗,cet6,She screwed the lid tightly onto the jar.,medium
script,脚本;剧本;手稿;字迹;笔迹;书写体;字体;书写系统;脚本语言,cet6,The script was written by a famous playwright.,high
scrub,擦洗;刷洗;擦净;擦掉;取消;放弃;灌木丛;矮树丛;擦洗;刷洗;洗涤,cet6,She scrubbed the floor until it was clean.,medium
scrutiny,仔细审查;仔细观察;细看;监视;监督;详细审查;周密检查,cet6,The document was subjected to close scrutiny.,medium
sculpture,雕塑;雕刻;雕塑品;雕刻品;雕刻术;雕塑术;雕像;塑像;雕刻;塑造,cet6,The sculpture is made of marble.,high
sea,海;海洋;海域;大量;许多; wide;广阔;似海的;海生的;航海的,cet6,The sea is calm today.,high
seal,印章;图章;封条;密封;海豹;密封;封住;封锁;盖章;保证;决定,cet6,She sealed the envelope before mailing it.,high
seam,接缝;缝;缝合线;层;煤层;矿层;使接合;缝合;焊接;裂开;出现裂痕,cet6,The seam of the dress came apart.,medium
search,搜索;搜寻;查找;搜查;探求;调查;研究;搜索;寻找;搜查,cet6,The police searched the house for evidence.,high
season,季节;时期;旺季;赛季;调味;给增加趣味;使适应;风干,cet6,Spring is my favorite season.,high
seasonal,季节的;季节性的;周期性的;随季节变化的;季节性的;季节性的,cet6,Seasonal fruits are cheaper.,medium
seat,座位;席位;所在地;中心;屁股;使就座;使就坐;容纳;可容纳,cet6,Please take a seat.,high
second,第二;秒;第二名;次等的;二等的;第二的;支持;附议;赞成,cet6,She came second in the race.,high
secondary,次要的;第二的;中等的;中级的;副的;间接的;从属的,cet6,The secondary road is less crowded.,high
secrecy,秘密;保密;秘密状态;保密能力;隐蔽;隐瞒,cet6,The meeting was held in secrecy.,medium
secret,秘密;机密;秘诀;奥秘;秘密的;机密的;隐秘的;神秘的,cet6,Can you keep a secret?,high
secretary,秘书;书记;部长;大臣;干事;文书;书记员,cet6,She works as a secretary at the company.,high
section,部分;区域;部门;章节;截面;切片;剖面;地段;路段;切;分割,cet6,The library has a section for children books.,high
sector,部门;领域;行业;区域;扇形;地段;战区;防区;部分;成分,cet6,The private sector creates many jobs.,high
secure,安全的;牢固的;稳固的;获得;保护;使安全;担保;缚紧,cet6,Make sure the doors are secure before leaving.,high
security,安全;保安;保证;证券;抵押品;安全性;保安措施;保护,cet6,The airport has tight security.,high
seed,种子;籽;萌芽;起源;种子选手;播;种植;播种;除去籽;在...播种,cet6,She planted the seeds in the garden.,high
seek,寻找;寻求;追求;探索;征求;试图;企图;探寻;搜索,cet6,You should seek professional advice.,high
segment,部分;片段;段;节;环节;部分;分割;分段;划分;分裂,cet6,The company targets a specific market segment.,high
segregate,隔离;分开;分离;使隔离;使分开;实行种族隔离,cet6,The schools were segregated by law.,medium
